comment_id,self_text,subreddit,created_time,post_id,author_name,user_account_created_time,user_total_karma
k4bmeb1,"Collateral damage involving a child is sad. However, invading someone's home and choosing to murder them is a little bit different.",IsrealPalestineWar_23,2023-10-10 20:15:55,174nvvc,prelude2007,2022-05-27 22:11:24,65.0
k4bme4s,"both sides have committed war crimes, Can you say that There have not been Israeli solders who have murdered Palestinian families???????",IsrealPalestineWar_23,2023-10-10 20:15:53,173z69z,zarboth,2018-06-22 05:11:54,1363.0
k4bmbjh,Use it as a dump?👍,TerrifyingAsFuck,2023-10-10 20:15:28,174pwu2,Irnbru51,2023-07-18 16:43:07,2726.0
k4bllof,This entire thing is just so fucking sad,IsrealPalestineWar_23,2023-10-10 20:11:13,174o2qt,jaytcfc,2023-08-01 12:01:58,20953.0
k4blhly,This entire thing is so so so fucked and sad,IsrealPalestineWar_23,2023-10-10 20:10:32,174ce3g,jaytcfc,2023-08-01 12:01:58,20953.0
k4bkavw,Isreal should kill all children women and man No mercy any in gaza strip kill all people in gaza strip and Isreal burn every children women man .......continue Isreal don't stop you fight with animals,IsrealPalestineWar_23,2023-10-10 20:03:32,174luqs,Consistent-Tip9959,2023-10-08 21:12:48,1.0
k4bi20z,let em burn...,IsrealPalestineWar_23,2023-10-10 19:50:09,174seli,dfault1974,2019-03-18 15:47:37,1520.0
k4bhsbc,"Are you retarded?

Fire mortars from an apartment building, at armed military forces, you can expect a retort from said military.",IsrealPalestineWar_23,2023-10-10 19:48:32,173y2xf,HisGibness,2013-12-17 15:14:07,89954.0
k4bhmm7,blood for blood,IsrealPalestineWar_23,2023-10-10 19:47:35,173z69z,naztynestor,2017-07-03 15:16:47,41459.0
k4bhhw5,They’re about to get an education that’s for sure,IsrealPalestineWar_23,2023-10-10 19:46:49,1742ehr,HisGibness,2013-12-17 15:14:07,89954.0
k4bh3zt,Not sure what your watching but Gaza bout to get leveled homie,IsrealPalestineWar_23,2023-10-10 19:44:30,174a5ob,HisGibness,2013-12-17 15:14:07,89954.0
k4bgzx1,Burn Baby Burn!!,IsrealPalestineWar_23,2023-10-10 19:43:49,174seli,Afraid_Ad7744,2020-10-02 19:59:28,16.0
k4bgws8,"it was texas raiders

the wiki mentions it, but also you can see the signature red tail in the video",TerrifyingAsFuck,2023-10-10 19:43:18,174hw6w,bubuzayzee,2016-11-03 04:49:18,38018.0
k4bfhen,"He’s not engaging anything or anyone

Putting his rifle around the corner and shooting blindly.

No different than a spay and pray 

🤡",IsrealPalestineWar_23,2023-10-10 19:34:50,174sebr,HisGibness,2013-12-17 15:14:07,89954.0
k4bdwp7,That poor beautiful vintage bomber.,TerrifyingAsFuck,2023-10-10 19:25:31,174hw6w,ALostGawd,2019-12-15 06:26:38,15487.0
k4bdav2,yiip. oh well...just another day on reddit haha,TerrifyingAsFuck,2023-10-10 19:21:58,174hw6w,slackeye,2018-05-22 02:24:00,28517.0
k4bd7sf,Is there a bridge in the middle? That's kinda neat,TerrifyingAsFuck,2023-10-10 19:21:29,174pwu2,Fido29,2021-02-27 13:29:46,6358.0
k4bcv02,I hope Palestine is wiped off the map,IsrealPalestineWar_23,2023-10-10 19:19:26,172kfr9,8ball13,2019-01-15 20:45:49,386.0
k4bct9s,"lol, she has things to do...the kids wanted Burger King",TerrifyingAsFuck,2023-10-10 19:19:08,174hw6w,Altruistic-Status-98,2022-03-04 16:08:57,2036.0
k4bagtk,"Not part of any 5%.   Conversely, you appear to be someone who believes cows are sacred and there are multiple gods.   Fairy tale shit, ya know ?",IsrealPalestineWar_23,2023-10-10 19:05:20,173y2xf,toosmoov536,2018-03-09 02:33:19,44.0
k4b9zbm,"OP doesn’t  give af about cnn.   I see two sides both engaging in killing women and children.  Shameful across the board, religion agnostic.",IsrealPalestineWar_23,2023-10-10 19:02:25,173y2xf,toosmoov536,2018-03-09 02:33:19,44.0
k4b91rv,There’s a secondary explosion in a residential area— say what you will— fact is that says something about the people who put the explosives there.,IsrealPalestineWar_23,2023-10-10 18:56:55,174ce3g,renebeans,2021-06-27 04:23:34,5531.0
k4b8yeo,Nearly got the truck with its lift kit putting it up in the flight path.,TerrifyingAsFuck,2023-10-10 18:56:21,174hw6w,Benobo-One-Kenobi,2021-12-25 20:23:16,1009.0
k4b8w4l,One guy really literally living on the edge,TerrifyingAsFuck,2023-10-10 18:56:00,174pwu2,oldbased,2021-12-31 01:18:09,32488.0
k4b8axq,Have them FEAR you Isreal . Let their God sort them out,IsrealPalestineWar_23,2023-10-10 18:52:35,174o2qt,PrestigiousAd975,2021-01-23 05:31:34,137.0
k4b7h3f,That how karma whores work. They get it wrong on purpose so more people will comment to correct it.,TerrifyingAsFuck,2023-10-10 18:47:44,174hw6w,Neako_the_Neko_Lover,2019-07-01 20:25:37,119574.0
k4b7873,Respect for not arguing for nothing and accept that you fucked up,TerrifyingAsFuck,2023-10-10 18:46:16,174hw6w,Yamanikaro7,2021-08-12 21:21:44,15494.0
k4b5mpp,Burning Hamas 👍,IsrealPalestineWar_23,2023-10-10 18:36:49,174seli,dexter1959,2022-05-19 07:04:52,6971.0
k4b5ams,"Those ""innocents"" were celebrating, I watched a video of Palestinian children hitting a young Israeli boy that was taken hostage with a stick. 

They are just as guilty as Hamas of they were truly for peace they would fight against terrorism not condone it. 

They have teens running around with the gunmen taking videos spitting on raped and killed women.",IsrealPalestineWar_23,2023-10-10 18:34:51,174ce3g,Holiday-Albatross184,2021-12-30 08:45:02,9826.0
k4b592f,"Have land, will use!",TerrifyingAsFuck,2023-10-10 18:34:36,174pwu2,AJ_Deadshow,2021-04-09 18:21:00,246310.0
k4b4wg2,average russian reaction,IsrealPalestineWar_23,2023-10-10 18:32:29,1746bo2,TheSilentFlame,2020-09-30 23:57:57,3602.0
k4b4jkg,Oh my god....they were roomates,TerrifyingAsFuck,2023-10-10 18:30:22,174hw6w,LurkzMcgurkz,2019-06-13 17:43:59,24681.0
k4b4gfz,"I believe it was show that the fighter has limited cockpit visibility, and at the high bank it was in, the pilot may well have not seen the bomber at all.

The NTSB has at this point mainly blamed that and bad airshow planning.",TerrifyingAsFuck,2023-10-10 18:29:51,174hw6w,ahmc84,2015-02-08 03:38:37,95964.0
k4b4dcq,Oh it will someday!,IsrealPalestineWar_23,2023-10-10 18:29:20,1748yrx,Character_Ad_7798,2022-02-28 20:59:54,6408.0
k4b3x6w,"no, they were clearly let down from the impact plume",TerrifyingAsFuck,2023-10-10 18:26:39,174hw6w,aztec_armadillo,2012-08-15 15:15:04,10538.0
k4b3pqz,If only half of the men had guns they could have taken these assholes down.,IsrealPalestineWar_23,2023-10-10 18:25:24,173z69z,Momsolddildo-2,2022-08-12 20:42:48,512.0
k4b3o3d,If someone pays your rent do you suddenly have more disposable income to spend in other areas? Obviously yes. Humanitarian aid to hostile nations absolutely frees up additional resources to fund their activities.,IsrealPalestineWar_23,2023-10-10 18:25:08,173t6zp,SAR-421,2021-04-06 14:31:31,2147.0
k4b3nv2,"No, they were wearing helmets and kneepads.",TerrifyingAsFuck,2023-10-10 18:25:05,174hw6w,Nochnichtvergeben,2022-05-04 14:26:51,166177.0
k4b3h1b,"They prod Israel to get a reaction to publicize it to other Palestinians,  and feed the hate they have for Jews.",IsrealPalestineWar_23,2023-10-10 18:23:58,1742ehr,polvo2023,2023-10-10 17:35:31,2.0
k4b3chr,The P63 was in a high g turn and could not see the B17 from his attitude.,TerrifyingAsFuck,2023-10-10 18:23:13,174hw6w,velhaconta,2019-10-18 16:33:12,180636.0
k4b37k8,Ohmafuckinggaawd!,TerrifyingAsFuck,2023-10-10 18:22:25,174hw6w,Nochnichtvergeben,2022-05-04 14:26:51,166177.0
k4b312z,Ermergaaawd!,TerrifyingAsFuck,2023-10-10 18:21:20,174hw6w,Nochnichtvergeben,2022-05-04 14:26:51,166177.0
k4b2yaa,The small fighter deliberately took down the B-17. There’s no way that was accidental. I’m thinking it had to be a personal grudge.,TerrifyingAsFuck,2023-10-10 18:20:52,174hw6w,Contrails11,2020-10-21 15:30:18,55.0
k4b2kji,They really farm right to the edge of that chasm.,TerrifyingAsFuck,2023-10-10 18:18:36,174pwu2,-P-M-A-,2020-01-05 15:20:17,120778.0
k4b2jr0,Well put. 👍🏽,IsrealPalestineWar_23,2023-10-10 18:18:28,174nvvc,polvo2023,2023-10-10 17:35:31,2.0
k4b2dce,"I don't know. But I know no religion has the answers. We are on a speck of dust in a vast universe we barely comprehend. But, sure, your book of fairytales explain everything.",IsrealPalestineWar_23,2023-10-10 18:17:24,1744vbi,ExOblivion,2010-10-14 05:34:28,21566.0
k4b1b0r,Mr. President a plane has hit the second plane,TerrifyingAsFuck,2023-10-10 18:11:00,174hw6w,Banana_Slugcat,2023-09-12 19:12:23,305676.0
k4b0xlt,Think next time.,TerrifyingAsFuck,2023-10-10 18:08:45,174hw6w,Aidernz,,3472.0
k4b0x6s,Damnit can we stop destroying all our B-17s,TerrifyingAsFuck,2023-10-10 18:08:41,174hw6w,JiffyJelly,2019-02-15 16:06:38,17177.0
k4b0nie,It’s true kind of ironic most the Israelites want total extermination. Sounds like certain Austrian Painted,IsrealPalestineWar_23,2023-10-10 18:07:03,174ce3g,Ok_Caterpillar1815,2023-07-07 16:48:27,2.0
k4azzpf,"Some propeller aircraft are actually jets, but you're right. Both of these planes have piston engines",TerrifyingAsFuck,2023-10-10 18:03:02,174hw6w,dfelton912,2019-07-06 04:01:51,113130.0
k4azr52,I think they were talking about the planes,TerrifyingAsFuck,2023-10-10 18:01:36,174hw6w,corinadoulin,2022-04-01 16:08:48,44796.0
k4az9oh,Sad thing she wasn’t even a soldier and some of them were civilians,NoahGetTheBoat,2023-10-10 17:58:41,172uuzp,Vast-Willow-8206,2021-09-19 22:15:16,75.0
k4aymbk,"This was at an airshow in Texas. A lot of planes in relatively close proximity to each other, it is bound to happen sooner or later.",TerrifyingAsFuck,2023-10-10 17:54:48,174hw6w,Snadzies,2013-08-09 06:24:56,17145.0
k4aycsh,Still not a good thing to have inside of you lol,TerrifyingAsFuck,2023-10-10 17:53:13,174lrdl,Sprizys,2019-01-18 05:19:16,525400.0
k4awwxs,"Hamas, but theyvare using civilians and their infrastructure as shields. When it gets bombed, they cry out and point their fingers at the jews for retaliating when they were shot at and their people killed.",IsrealPalestineWar_23,2023-10-10 17:44:41,173y2xf,RailOmas,2019-10-25 00:33:13,10521.0
k4awrz1,"Damn, those are relics. Shame.",TerrifyingAsFuck,2023-10-10 17:43:52,174hw6w,PANDAshanked,2018-10-20 16:03:47,4606.0
k4awowj,Hamas has literally said this was planned and funded with and by the Iranians.,IsrealPalestineWar_23,2023-10-10 17:43:22,173t6zp,Wu-Crypto,2021-11-11 03:11:41,122.0
k4awfqn,If you ever see the pic of the pilot in the bomber as it’s going down it’s truly harrowing,TerrifyingAsFuck,2023-10-10 17:41:52,174hw6w,More_Coffees,2021-05-03 03:35:35,25383.0
k4av87e,"You can watch her whole thought process from the rear. ""Oh my god i should...Maybe if I...Yeah there's nothing.""",TerrifyingAsFuck,2023-10-10 17:34:40,174hw6w,GoldenReggie,2014-04-08 11:52:50,2389.0
k4atpkq,Legend 👌👌,TerrifyingAsFuck,2023-10-10 17:25:34,173v1k8,loniscup,2014-12-13 12:44:05,1588.0
k4ato7n,"Read. A lot, apparently.",IsrealPalestineWar_23,2023-10-10 17:25:20,174pcze,dexter1959,2022-05-19 07:04:52,6971.0
k4atncm,"I am not a doctor, but I work with surgical equipment everyday.",TerrifyingAsFuck,2023-10-10 17:25:12,174lrdl,Hoss-Hoss-Hoss,2023-08-10 21:02:39,6792.0
k4ate7x,u/savevideobot,IsrealPalestineWar_23,2023-10-10 17:23:40,174cp41,tandemuis365,2022-11-12 20:03:08,37802.0
k4atc20,This is a horrendous breach of  procedure.,TerrifyingAsFuck,2023-10-10 17:23:18,174lrdl,Hoss-Hoss-Hoss,2023-08-10 21:02:39,6792.0
k4at7b6,u/savevideobot,IsrealPalestineWar_23,2023-10-10 17:22:31,174o2qt,tandemuis365,2022-11-12 20:03:08,37802.0
k4asdts,Nothing it's just means that he was meant to die in technology and equipment dating back to the 1940s .,TerrifyingAsFuck,2023-10-10 17:17:39,174hw6w,Ok-Judgment9477,2022-09-21 20:36:38,1136.0
k4ardbz,"Whoever gave them the resources and training definitely has a plan. Hamas must know the IDF will enter Gaza, it will be a bloodshed if they do and maybe give Iran and others an excuse to get involved because I can’t understand why Hamas would make a blitz, kidnap people and then return to Gaza for no reason, they’re barbaric but they clearly aren’t stupid. I don’t want to be a conspiracy theorist but I have a feel that something bigger is at play.",IsrealPalestineWar_23,2023-10-10 17:11:32,174luqs,DrClu33,2017-07-05 22:17:26,10352.0
k4aqzgm,Who made the devil?,IsrealPalestineWar_23,2023-10-10 17:09:14,1744vbi,sleepy-broccoli,2023-05-30 18:56:22,348.0
k4aqaa7,"Op: We should stop with religious wars and nonsense.
You: nuh uh. My God is better than your god.
Yet Jews, Christians, and Muslims worship the same God of the Bible.",IsrealPalestineWar_23,2023-10-10 17:05:01,1744vbi,sleepy-broccoli,2023-05-30 18:56:22,348.0
k4aq4vp,Inelastic physics.,TerrifyingAsFuck,2023-10-10 17:04:06,174hw6w,Stainless_Heart,2017-05-31 20:03:13,123715.0
k4apyex,Is Israel scared to send in troops instead of just bombing building that don’t discriminate between civilians and soldiers.,IsrealPalestineWar_23,2023-10-10 17:03:01,174ce3g,New_ape_from_CO,2021-06-02 09:51:00,2333.0
k4app0d,Man humanity is dumb. Rejoicing over innocent lives lost no matter the nationality is disgusting. Nothing glorious to celebrate. I feel bad for the people that think this is OK just shows how badly they are brain washed.,IsrealPalestineWar_23,2023-10-10 17:01:25,1746bo2,buckthemike,2019-08-29 19:09:02,40.0
k4apmya,Holy fuck. There was so much sky though.,TerrifyingAsFuck,2023-10-10 17:01:04,174hw6w,havocLSD,2018-03-20 02:09:42,515477.0
k4ap5o6,Well if you had 96 year olds piloting you might have situation like this one so is it rly so unreasonable to assume?,TerrifyingAsFuck,2023-10-10 16:58:12,174hw6w,roastinpeace,2016-09-05 20:04:01,9312.0
k4ap2xc,Which one is based on testing and replicability again? I always get the two confused.,IsrealPalestineWar_23,2023-10-10 16:57:44,1744vbi,sleepy-broccoli,2023-05-30 18:56:22,348.0
k4aokab,"Thank you it seems both sides never want to admit fault nor actually help each other. Seems like everyone today just wants to play the victim or hero. Rather we should strive to find resolutions and diplomacy. There needs to be recognition that there are some good things that have happened with republicans and democrats. However, that being said we do need anti corruption laws in place to this circus. Until then the show must/will go on. Money and power perverts truth and true progress/healthy growth.",IsrealPalestineWar_23,2023-10-10 16:54:40,173t6zp,buckthemike,2019-08-29 19:09:02,40.0
k4aoav7,"When a guy lands in a music festival with unarmed civilians and 250 were killed, more injured, and more killed while fleeing and that not being the only attack on purely civilians ... people getting pulled from cars and getting murdered, going house to house and executing... kids being targeted... they went on a horrific spree on civilians. it's a difficult situation over there for sure, tragedy on both sides. 

If they stuck to military targets it's a different thing entirely. 

I am only commenting on that day not the tragic history of the area. We've also seen Israels reaction.",IsrealPalestineWar_23,2023-10-10 16:53:08,174nvvc,Interesting-Effect56,2020-11-15 15:04:28,6235.0
k4ao6rc,oh mah gawd,TerrifyingAsFuck,2023-10-10 16:52:28,174hw6w,the-iter8,2022-07-22 13:24:12,2357.0
k4amm5u,This is a helpful point of view.,IsrealPalestineWar_23,2023-10-10 16:43:00,173y2xf,toosmoov536,2018-03-09 02:33:19,44.0
k4amf5r,"I'm not a real doctor, but most people who don't support Isreal in their imperialism and atrocities also don't support the US imperialism and atrocities either.",IsrealPalestineWar_23,2023-10-10 16:41:50,1742ehr,sleepy-broccoli,2023-05-30 18:56:22,348.0
k4alaoa,"Did they know something was coming? Yes.  But it needs to be understood that the complexity of this attack was insane, and the warnings they had gotten were not specific.  What were they supposed to do, not celebrate any holidays and remain on high alert indefinitely waiting for an attack that might not even come?",IsrealPalestineWar_23,2023-10-10 16:35:08,173ok9n,Worldsprayer,,335.0
k4akrvb,"Ironically you can blame the UK.  In the 1920s they had been given the mandate by the league of nations to settle jews in Palestine.  At the time, there was no palestinian people and the only population groups were nomadic bedouin's and ironically, jews who had made their way back to jerusalem on their own.  The majorityh ethnic group in the region of actual residents was jewish for a while.

The problem is that the UK deliberatel ysabotaged their mandate and they assigned as the ""Chief"" of resettlement a fervant anti-jew arab who began immigrating arabs from all over the region.  These people became the first ""palestinians"" because until then there was no such people.  WHen they arrived they began pogrom after pogrom trying to kill the local jews.

The UK would abandon its mandate in the 30s, and the reformed United Nations would then try again 1947/48 by which point there had been discussions and deals in multiple channels with what was literally a new population of people that had spent 20 years living in the region after coming there.

Ironically from the get go Palestine was supposed to have a nation in the west in gaza, and a nation in the east in the westbank.  The local jews had agreed to this even.  The issue though is that ltierally every single arab nation said NO to the deal.  On teh day that the UN released its authority in the region, every single surrounding arab nation attacked beginning a wave of wars that Isreal somehow repeatedly won.  


From tehre on, it's a complicate back/forth wave of history that gets more violent and complicated as time goes on.  By this point, there is no one side that's innocent or at fault.  They've simply been fighting for 5 generations now.",IsrealPalestineWar_23,2023-10-10 16:31:59,1748yrx,Worldsprayer,,335.0
k4ako4v,Smaller plane never saw the bigger plane. He was doing a high g turn and the bigger plane would have been *below* him relative to his attitude and not visible.,TerrifyingAsFuck,2023-10-10 16:31:21,174hw6w,velhaconta,2019-10-18 16:33:12,180636.0
k4akg8z,"When a plane flies directly into another plane, they have a tendency to explode catastrophically.",TerrifyingAsFuck,2023-10-10 16:30:03,174hw6w,velhaconta,2019-10-18 16:33:12,180636.0
k4akate,First operational jets entered service during WWII. But they weren't the planes in this video.,TerrifyingAsFuck,2023-10-10 16:29:10,174hw6w,velhaconta,2019-10-18 16:33:12,180636.0
k4ak45s,"The extremists would not be able to function if it were not for the support of the people. Israel has given so many concessions over the decades and look what it got them, their people slaughtered not for military or political gain, just because. Israel going to have to do what we learned to do in WWII to stop this BS, bomb the populous into submission to the point where there is no will left to support those that they now support.",IsrealPalestineWar_23,2023-10-10 16:28:03,174ce3g,dropdfun,2013-07-10 23:55:43,46.0
k4ak30l,"That was 1 of the 5 remaining B17 that are still airworthy. 

I assume it was [Sentimental Journey (44-83514)](https://en.wikipedia.org/wiki/Sentimental_Journey_(aircraft\)) or [Texas Raiders (44-83872)](https://en.wikipedia.org/wiki/Texas_Raiders).",TerrifyingAsFuck,2023-10-10 16:27:52,174hw6w,velhaconta,2019-10-18 16:33:12,180636.0
k4ak2ao,"I agree because evil is man-made. But if religion was erased, the earth might have a chance.",IsrealPalestineWar_23,2023-10-10 16:27:44,1744vbi,jamiejames_atl,2021-01-29 20:56:02,32892.0
k4ajvc8,"There is no devil. Well, maybe Hamas. Or ISIS. Or Warren Jeffs. Man made up the devil to excuse his own evil. Too arrogant/self-absorbed to take the blame for their evil. Make up a god and devil to blame.",IsrealPalestineWar_23,2023-10-10 16:26:35,1744vbi,jamiejames_atl,2021-01-29 20:56:02,32892.0
k4ajpkc,"At the moment this is just a rumor.  Theres nothing on any of their telegrams or discords indicating such, there is even a proof of life video from later.",IsrealPalestineWar_23,2023-10-10 16:25:38,1741icm,Worldsprayer,,335.0
k4aizln,"Why does there have to be an explanation? Why is it so hard to say “I don’t know.”? Why is not knowing, worse than righteous terror?",IsrealPalestineWar_23,2023-10-10 16:21:20,1744vbi,jamiejames_atl,2021-01-29 20:56:02,32892.0
k4aixpk,Source?,IsrealPalestineWar_23,2023-10-10 16:21:01,174cpcx,Euphoric_Race_9248,2023-09-11 17:23:56,3308.0
k4aixk0,"Congratualtions, you are a victim of propaganda.  In this case, it's propaganda by hamas becasue what they do is place all their military hardware within and underneath civilian targets.That way even when they lose the military ahrdware in a strike, they GAIN propaganda power to effect people like you because they can show civilian homes being destroyed.

If you're curious, ukraine was also doing this and apparently still is to an extent, especially early on in the ukraine conflict, many of the strikes in ukraine on civilian targets ( a mall is the best example where theres video and images) was because ukraine was storing military hardware there.

While that's no longer the case because it backfired, it was powerful starting propaganda there as well.",IsrealPalestineWar_23,2023-10-10 16:21:00,173y2xf,Worldsprayer,,335.0
k4aiv3s,"I made a mistake with misremembered information, I did try and correct it by editing my original post with the official information.",TerrifyingAsFuck,2023-10-10 16:20:36,174hw6w,sykoKanesh,2012-06-08 21:25:23,34073.0
k4aiky4,Look I never would call for violence but can we just imbed her with Hamas fighters and see what happens? Maybe airdrop her down onto the Gaza Strip with a name tag and let them know she’s coming and than just see how long she lasts,IsrealPalestineWar_23,2023-10-10 16:18:56,174cpcx,Euphoric_Race_9248,2023-09-11 17:23:56,3308.0
k4aihul,"Thanks.  I appreciate.  Whenever I see something talked about in the media especially in the Middle East I try to educate myself as much as possible.  

Last night I watched some testimony from some Palestinians on you tube and Tik tok.  And then some Jews from the region explaining how Palestinians
have been treated over the last centuries.  It seems like they have been very mistreated and the fighting started a long time ago and it’s been an ongoing rivalry for many many years.  Each side trying to one up each other by whatever means possible. And the poor conditions in Gaza.  But that doesn’t justify murdering children.  Nothing does.

It needs to stop.  Both sides.  I’m not taking sides I take the side of peace.  There’s always a way.  Stop treating someone like they’re less than you because you don’t believe like they believe.  I remember jews being made fun of in America in grade school in Texas.  And blacks.  It would make me cry in my bed at night as a little girl.  It makes me happy to see the one Jewish boy from school doing very very well for himself after struggling for a long time to get an education.  He is quite wealthy now. 👏🏻

I refuse to let the US media tell me how I should think and feel about a conflict.  Thanks to social media and people putting their testimony in front of a camera I can be well informed.  If someone chooses not to be informed they are ignorant, they should take the time to find out what’s going on first.",IsrealPalestineWar_23,2023-10-10 16:18:25,1748yrx,Fishon72,2020-09-14 21:16:40,7660.0
k4agg3f,"It’s possible the attack was partially funded as a result of the 6 Billion released.  It doesn’t matter the 6 Billion was designated to be used only for humanitarian needs - like food.   If they cut those costs from their other accounts, that frees up money that can be diverted to anything else.  It also doesn’t matter if the 6 Billion hasn’t been spent yet.  The anticipation of funds has the same effect as actually having the funds.  Russia is increasing their military spending by 70% next year based on the projection of elevated future oil export revenues.  If I won the Powerball this week but couldn’t claim it for three months while I assemble a team of lawyers and investment professionals, I would still quit my job today and start going on a spending spree maxing out my credit cards in anticipation of the future funds.",IsrealPalestineWar_23,2023-10-10 16:06:02,173t6zp,Fantastic-Moose-8089,2021-06-07 03:10:38,54.0
k4ag8gw,A real muslim is a real piece of shit on the society of earth. they bring nothing to the table except backwards idealogies and stinky armpits.,IsrealPalestineWar_23,2023-10-10 16:04:45,173avza,IdRatherBSleddin,2020-02-09 18:32:09,2154.0
k4afwzd,"The pilot was born 20 or 30 years after the war ended, according to this. He most certainly was not a B17 pilot in WWII.",TerrifyingAsFuck,2023-10-10 16:02:47,174hw6w,DrProfDoommuffinsPhD,2022-08-06 15:38:16,86847.0
k4afkx8,No they have airbags,TerrifyingAsFuck,2023-10-10 16:00:47,174hw6w,BettmansDungeonSlave,2015-08-21 18:27:06,195507.0
k4afdj3,"I guess no one gets your joke, OP deserves these downvotes for calling a WWII bomber a “jet” …",TerrifyingAsFuck,2023-10-10 15:59:32,174hw6w,snoandsk88,2018-09-25 11:50:03,191042.0
k4afau6,You sunk my battleship,TerrifyingAsFuck,2023-10-10 15:59:05,174hw6w,Trick-Station8742,2023-07-03 23:39:35,44237.0
k4af3rj,What are you talking about?,TerrifyingAsFuck,2023-10-10 15:57:55,174hw6w,pambannedfromchilis,2018-05-28 18:25:23,175690.0
k4aeyu8,That’s not a jet,TerrifyingAsFuck,2023-10-10 15:57:05,174hw6w,snoandsk88,2018-09-25 11:50:03,191042.0
k4aev0o,"Yeah! How dare Israel react to terrorists attacking and killing their women, children, and elderly! 
If my neighbor raped and killed my family I would be really concerned about how he is doing through this traumatic experience!",IsrealPalestineWar_23,2023-10-10 15:56:27,1744d56,Dunking_Dutchman45,2017-12-04 16:52:24,-30.0
