comment_id,self_text,subreddit,created_time,post_id,author_name,user_account_created_time,user_total_karma
k47rwi3,"The moment I saw your name ı feared you'll defend israel to death haha. 

It's weird to seeing 100 indian spawned whenever something bad about muslims happens. I can understand you guys hate pakistanis, I don't like them too lol. But it's weird afterall",NoahGetTheBoat,2023-10-10 01:27:42,173nw8f,osbirci,2018-12-06 20:30:07,22491.0
k47rvhm,"They also provided protection to all the German scientist, America dose what benefits America selling weapons waging war for profit to think they care about democracy in the Middle East is cute they always play both sides and make the most money",IsrealPalestineWar_23,2023-10-10 01:27:31,1746dvd,WeeWeePeePeeBoy,2020-12-21 02:18:04,49.0
k47rr6q,People who don't want to live a long life.,TerrifyingAsFuck,2023-10-10 01:26:42,173v1k8,sascha_nightingale,2020-04-02 07:35:59,8461.0
k47rkav,"Absolutely. 

99% of people who support Palestine do not support Hamas. It is a terrorist group. It is evil. It isn’t good for its own people. It does want to genocide Jews. The only reason Palestinians put any support behind them is because they don’t really have many other options, nobody else is really coming to bat for them and laying down and taking it from Israel hasnt made things better in the past, so they have to by default turn to the only entity that seemingly is doing SOMETHING, and because of that Hamas ends up being able to push a narrative to the Palestinian people. 

This is largely a leadership issue. But obviously the situation has created cultural shifts that have bled into the populations and altered how they view the other side. 

Unfortunately it’s not a one side issue where if you remove one king from the chess board then the game is resolved. If Israel were to surrender (it never would and there’s no situation where Hamas can make them) then Hamas would attempt a genocide on the Israelis. If Palestine where to surrender (or be completely wiped out, both strong possibilities right now), then Israel would all but absorb the small portion of territory Palestine still has left and functionally drive their people out, if not subject them to an even harsher apartheid state than they’re already in. Basically, things get worse if either side wins. It’s either some form of mutual agreement or the suffering grows so great that it leads to the genocide of the losing side.",NoahGetTheBoat,2023-10-10 01:25:24,173nw8f,wastelandhenry,2016-12-30 08:55:14,34676.0
k47rk7f,"Yeah, that’s not it but you’re horrible for rebranding it",IsrealPalestineWar_23,2023-10-10 01:25:23,1741icm,T_J_S_,2021-10-11 22:10:50,33568.0
k47r8oa,"You ever try to explain to people that believe in this stuff that if they were able to capture video, record sitings, take samples, and analyze data gathered by what they thought were paranormal, it would no longer be paranormal?

In other words, if you can use scientific tools to measure and experience a phenomenon, then it's clearly part of the physical world.",TerrifyingAsFuck,2023-10-10 01:23:13,171ibwg,Phoebesgrandmother,2016-11-28 15:13:32,37443.0
k47r8mc,This video is an old video. Venezuelan vigilante justice. Her and some men robbed and murdered a store owner. They caught her and set her on fire. She was 16.,IsrealPalestineWar_23,2023-10-10 01:23:13,1741icm,sdbrinkerhoff,2021-03-17 23:18:21,2270.0
k47r78l,"Yes, I’ll stand still. Exhibit A:
 https://reddit.com/r/PublicFreakout/s/1f5vXpVbht",IsrealPalestineWar_23,2023-10-10 01:22:57,1744d56,Equivalent_Ad6826,2021-03-04 20:41:28,1825.0
k47r1k3,"Exactly! It has nothing to do with USA, Biden, Dems vs Republicans. So stupid, just looking for someone to blame, &amp; blaming our own government for things that happening around the world. Putin invaded Ukraine, it's Biden's fault?  How stupid is this? How about Israelis have been molesting Palestinians for decades &amp; they just had enough.",IsrealPalestineWar_23,2023-10-10 01:21:55,173t6zp,Low_Willingness1735,2023-02-14 02:44:13,21369.0
k47qzxp,Cheering for civilian casualties against any side is when we lose our humanity.,IsrealPalestineWar_23,2023-10-10 01:21:37,1746bo2,DmtChimpanzee,2022-11-30 19:04:31,1768.0
k47qyky,"Just blame The trader of the free world”  for everything you all are talking about. Nobody is wrong if the USA is involved. Owned Joe is the thought, the catalyst, the gasoline, the dynamite, and the destruction of all good. He doesn’t get burned because he’s the Tin Man. 
I live in the USA and this doesn’t touch the things I want to say.",IsrealPalestineWar_23,2023-10-10 01:21:22,173hwub,timesaretough2023,2023-08-21 01:41:53,19.0
k47qsug,Because allah bad,IsrealPalestineWar_23,2023-10-10 01:20:19,1746dvd,invigoratingBog,,20.0
k47qp8t,I don’t think so,IsrealPalestineWar_23,2023-10-10 01:19:40,1741icm,RepresentativeTop687,2020-09-12 06:33:17,11.0
k47qfai,Appears so. Here’s the link,IsrealPalestineWar_23,2023-10-10 01:17:50,1741icm,RepresentativeTop687,2020-09-12 06:33:17,11.0
k47qe0w,https://x.com/shineoriginaldk/status/1711513902075224180?s=46,IsrealPalestineWar_23,2023-10-10 01:17:36,1741icm,RepresentativeTop687,2020-09-12 06:33:17,11.0
k47q9zc,"   Okay, then support communist palestine groups? 

   Israel even pour cement to their water sources and more and you're waiting people to be sivil. Oh those monsters, why didn't they  just post #freepalestine and cancel netanyahu?

   Gazze is a fucking modern version of nazi ghettos.  


Also not shooting civilians is impossible. Everywhere in that region filled with people.",NoahGetTheBoat,2023-10-10 01:16:53,173nw8f,osbirci,2018-12-06 20:30:07,22491.0
k47q8hn,"I don’t think they’re indiscriminately bombing like Hamas throws rockets. They’re dropping bombs on targets and homes of Hamas leaders, buildings know to be weapons caches, earlier they were bombing sites suspected to be areas where tunnels are, etc. you’re drawing a false equivalence based on nothing. OP is CNN’s fucking hero",IsrealPalestineWar_23,2023-10-10 01:16:37,173y2xf,Equivalent_Ad6826,2021-03-04 20:41:28,1825.0
k47q6a1,"Also, stupid &amp; ignorant!",IsrealPalestineWar_23,2023-10-10 01:16:13,173t6zp,Low_Willingness1735,2023-02-14 02:44:13,21369.0
k47pzko,"Here is a thought for the Republicans. Iran has been giving Putin free Shahed drones? Iran has been selling their weapons all over the world, not just Russia. Putin paid top dollars for those drones &amp; various weapons that Russia has been dropping on Ukraine are from Iran.",IsrealPalestineWar_23,2023-10-10 01:15:00,173t6zp,Low_Willingness1735,2023-02-14 02:44:13,21369.0
k47pu7w,"No. I have repeatedly stated Hamas is evil and needs to be destroyed. 

But that doesn’t change that fact that using children as human shields doesn’t work for propaganda unless the other side is willing to shoot a child being used as a human shield. 

Imagine you’re a cop in New York. Some lunatic with a gun takes a 5 year old kid as a hostage and stands behind him. If this lunatic has already killed two cops and is willing to kill more who try to stop him, does it suddenly give the cops the go ahead to riddle the 5 year old with bullets to kill the hostage taker? Does that change if the hostage taker and the child are both foreigners? 

Israel has expressed a blatant disregard for the lives of Palestinians, children included. And as we saw with America, when a major military power treats a population inhumanly and kills civilians en masse including children, it WILL be used as propaganda because why the fuck would you NOT? America used 9/11 as propaganda to fuel the war in the Middle East, and Pearl Harbor as propaganda to fuel efforts to join WW2. 

Israel’s treatment of Palestine is why Palestinians look to Hamas for answers, and Israel (much like America in the Middle East) is doing a “solution” that works to exasperate the problem they’re trying to solve. We saw it for the last 20 years, killing a bunch of kids to kill some terrorists just ends up turning the kids you didn’t kill into more terrorists than you managed to kill. Israel has shown zero interest in addressing the root of why Hamas even exists (spoiler alert, Israel played a very large direct role in its creation) in the first place to be able to shoot rockets.",NoahGetTheBoat,2023-10-10 01:14:01,173nw8f,wastelandhenry,2016-12-30 08:55:14,34676.0
k47po5v,"Likud didn't come to power until the late 1970s. Before that it was various center left and social democracy parties.

There was a whole tit for tat going on in the 60s with fedayeen attacks and IDF reprisals.

Since the War of Independence, the Arabs vowed to wipe out the Jewish State. 

Can you really blame the Jews for saying never again?",NoahGetTheBoat,2023-10-10 01:12:53,173nw8f,Embarrassed-Tune9038,2021-05-18 15:58:41,49688.0
k47pl38,I hear ya!,IsrealPalestineWar_23,2023-10-10 01:12:18,173hwub,timesaretough2023,2023-08-21 01:41:53,19.0
k47oyvl,Our president was having a cookout ignoring what’s happening on his watch.,IsrealPalestineWar_23,2023-10-10 01:08:07,173ok9n,timesaretough2023,2023-08-21 01:41:53,19.0
k47owb6,Fuck Allah! And fuck Jihad!,IsrealPalestineWar_23,2023-10-10 01:07:39,1744vbi,rolledupboogerz,2021-03-14 01:44:32,165.0
k47ovsd,Pile up the Arabs and let the birds feast.,IsrealPalestineWar_23,2023-10-10 01:07:33,172khar,Extreme_Tourist4807,2022-03-15 16:34:12,2.0
k47olht,"Republicans also think Biden also burned down Lahaina in Maui too. First, they said it was Oprah, when Biden was preparing to come to visit Lahaina, the Republicans in Hawaii said don't come, because he started the fire. Republicans will use any event in the world, &amp; blame Biden administration. Putin blamed Biden for his invasion of Ukraine. Next, we will see these Republicans will be saying Biden killed Jesus! PUTIN GETS Shahed DRONES from Iran FOR FREE?@!#$ Putin paid hundreds of billions for them, with the gas/oil money he sold to EU for decades.",IsrealPalestineWar_23,2023-10-10 01:05:39,173t6zp,Low_Willingness1735,2023-02-14 02:44:13,21369.0
k47ntyj,I don't WANT to know why it is ok to brutally kill innocent civilians and share the video on the internet so that certain 'people' (probably like you) can get high. If you want your children to live stop supporting  terrorists and stop using hospitals and schools as the base of terrorist operations.,NoahGetTheBoat,2023-10-10 01:00:37,173nw8f,deepjeep123,2018-10-06 05:50:37,5969.0
k47nftk,"If you feel that way about Israel then you must feel that way about America. You only have the freedoms you have right now because soldiers are out killing combatants, women, children, and innocent men. In the Iraq war will killed over a quarter million civilians. That’s just in Iraq america is the worlds largest country in the buisness of taking lives. Let’s talk about that you wanna?",IsrealPalestineWar_23,2023-10-10 00:57:55,1742ehr,RevolutionMain4549,2023-09-10 20:18:45,95.0
k47netu,Watch it,IsrealPalestineWar_23,2023-10-10 00:57:43,1748buz,Elegant_Sense9518,2021-09-27 17:18:19,60.0
k47mxzb,"Shitty propaganda! How about the Israelis have been molesting Palestine economy for decades. Israel has been stealing Palestinians land, block water to Palestinians towns &amp; villages, not allowing them to fish on their own ocean, take away their mineral rights, not allowing them to mine their own oil on their own territories, killing innocent children, &amp; civilians daily. But there were no coverages on this. Now the Israels are crying atrocities what Palestinians are doing what they have been doing to the Palestinians for decades. When you pushed people to desperation, desperate people will do desperate things to free themselves from bondage. Now the world start seeing years of abuse &amp; bully can do to these people.",IsrealPalestineWar_23,2023-10-10 00:54:37,1742ehr,Low_Willingness1735,2023-02-14 02:44:13,21369.0
k47mwqg,SpongeBob: “5 minutes later”,IsrealPalestineWar_23,2023-10-10 00:54:23,174115q,Equivalent_Ad6826,2021-03-04 20:41:28,1825.0
k47mu9q,Could you imagine if Mexico did this on U.S. soil... I'm actually happy they're are our neighbors at this point. Extremely hard working and have delicious food.,IsrealPalestineWar_23,2023-10-10 00:53:54,1741xo5,No_Bedroom_9705,2023-03-04 03:12:39,159.0
k47mtlw,"Gervais made a great point:
Destroy every religious text and all traces of all religions, then do the same for all science books and research. In 1000 years, the science books would return exactly as they are now. The religious texts would be gone for good. 

Religion is made up bullshit and is a cancer on society.",IsrealPalestineWar_23,2023-10-10 00:53:47,1744vbi,inspectherfrog,2020-02-21 02:22:44,5999.0
k47mkjf,"I believe there is consistent, but not overwhelming support for Jews.  Persecution and all.  I also believe that a majority of Americans don’t trust Muslims and have a hard on to see some get waxed right now.  No matter how oppressive Israel has been to Palestine",IsrealPalestineWar_23,2023-10-10 00:52:07,1746dvd,10202632,2017-02-27 20:01:41,60297.0
k47lrc0,It sounds like Iran was involved and now Hezbollah getting in the mix. Totally destabilizes the region with our long term ally. Plus Americans were definitely killed and taken hostage.,IsrealPalestineWar_23,2023-10-10 00:46:40,1746dvd,_snapcase_,2014-01-30 07:04:13,18760.0
k47lplk,i'd fall in love tbh,TerrifyingAsFuck,2023-10-10 00:46:21,173v1k8,voraciousflytrap,2021-05-29 02:08:27,22936.0
k47ljxt,“The military is getting sent over there or something” ffs,IsrealPalestineWar_23,2023-10-10 00:45:17,1746dvd,TheRealJehler,2021-02-13 15:43:33,27864.0
k47lg7c,"Ackshually, 6 billion like a week ago.",IsrealPalestineWar_23,2023-10-10 00:44:36,1746dvd,_snapcase_,2014-01-30 07:04:13,18760.0
k47ldsb,You're right they can tell if a pidegeon or dog gets close to the border you're gonna say multiple groups of armed men went unnoticed to the point of making it into nearby cities and not one alert ...not a single one at all. They shoot kids that throw rocks across a line like come on now,IsrealPalestineWar_23,2023-10-10 00:44:09,173ok9n,Rude-Mousse8021,2021-07-11 20:30:34,13.0
k47kpjn,Umm 11 Americans died. Some have been taken hostage. If you come to reddit to get your news then...,IsrealPalestineWar_23,2023-10-10 00:39:37,1746dvd,SunnyStride,2022-11-08 00:40:47,1895.0
k47knb7,"I held my breath through most of that video. Even knowing she survived by the title, I was terrified for her.",TerrifyingAsFuck,2023-10-10 00:39:12,173v1k8,Electrical_Beyond998,2022-07-19 09:34:19,74558.0
k47k7ut,"BS what justify for Israelis for decades of dominating &amp; molesting Palestinians economy, killing innocent Palestinians, taking away their lands, mineral rights, food supplies, water, not allowing them to fish on their own ocean front, &amp; limiting their electricity uses. Nothing justified kidnapping &amp; killing innocent, you are right about that. But you must look at what Israel did to escalate to this level. Israel is not innocent. For decades Israelis have been killing innocent Palestinians, but there were no news coverages, it all a hush, hush operations. Don't be tricked to think that Irael is innocent. Israel has been provoking Palestinians for decades.",IsrealPalestineWar_23,2023-10-10 00:36:19,173z69z,Low_Willingness1735,2023-02-14 02:44:13,21369.0
k47jre9,"I heard one reason was that Israel and Saudi were close to an agreement on peace, trade, etc.  Iran hates Saudi and vice versa.  This essentially stonewalled the finalization of that deal and destabilized the region to level not seen in decades.",IsrealPalestineWar_23,2023-10-10 00:33:18,1742ehr,Piwx2019,2019-06-20 18:28:48,60310.0
k47ji5j,Parasailing can be learned on YouTube,IsrealPalestineWar_23,2023-10-10 00:31:35,173hwub,Equivalent_Ad6826,2021-03-04 20:41:28,1825.0
k47j1zz,I wonder how many of them haven’t been killed,IsrealPalestineWar_23,2023-10-10 00:28:32,173avza,Equivalent_Ad6826,2021-03-04 20:41:28,1825.0
k47irgm,I appreciate your passion.  Is it fair to say that leadership and culture of both Israelis and Palestinians are really fucking over their populations?,NoahGetTheBoat,2023-10-10 00:26:33,173nw8f,Doibugyu,2016-05-07 14:15:05,19080.0
k47iha2,So like...you find that an appropriate military tactic?,NoahGetTheBoat,2023-10-10 00:24:40,173nw8f,Doibugyu,2016-05-07 14:15:05,19080.0
k47ieck,You live under a rock bro?,IsrealPalestineWar_23,2023-10-10 00:24:07,173z69z,Equivalent_Ad6826,2021-03-04 20:41:28,1825.0
k47ico5,"You’re doing a lot of whataboutism, and you’re also a fuckjn idiot",IsrealPalestineWar_23,2023-10-10 00:23:48,173z69z,Equivalent_Ad6826,2021-03-04 20:41:28,1825.0
k47iaxi,"Probably the most comprehensive, mature take I've seen  in a while.  I don't understand how so many people forget that it's OK to say that two sides of a conflict can both be wrong.  Israel is doing wrong things.  Hamas is doing wrong things.  Innocents pay the price and the world watches, or worse, supports one side over the other due to political leanings and interests.",NoahGetTheBoat,2023-10-10 00:23:28,173nw8f,Doibugyu,2016-05-07 14:15:05,19080.0
k47iata,Research,IsrealPalestineWar_23,2023-10-10 00:23:26,1746dvd,Fun_Abrocoma_7498,2022-04-09 21:25:30,7292.0
k47i0hz,🙄,IsrealPalestineWar_23,2023-10-10 00:21:30,1744vbi,Fun_Abrocoma_7498,2022-04-09 21:25:30,7292.0
k47hd1t,You sound like a infamous world leader of the 1930's.....shameful,IsrealPalestineWar_23,2023-10-10 00:17:00,172kghc,Ill-Television-5499,2020-07-23 02:17:44,247.0
k47hcap,Oh my God,TerrifyingAsFuck,2023-10-10 00:16:51,173v1k8,pablitopulido,2020-04-22 23:33:15,2914.0
k47gur9,"""when you sleep in Israel and wake up in Palestine...""",NoahGetTheBoat,2023-10-10 00:13:34,173nw8f,Tipsy247,2014-11-17 15:50:25,50221.0
k47gox9,Because we are constantly being distracted by things on the other side of the world so we ignore things in our backyard.,IsrealPalestineWar_23,2023-10-10 00:12:29,1746dvd,Illustrious_Aside_65,2020-07-13 00:09:17,2647.0
k47fdh8,Holy shit spell check my guy.,NoahGetTheBoat,2023-10-10 00:03:30,173nw8f,fkshcienfos,2019-07-17 23:20:54,14474.0
k47em09,She's weak,TerrifyingAsFuck,2023-10-09 23:58:15,173v1k8,Q13989731E,2019-07-15 13:40:37,56569.0
k47ei3j,But those threads.... They are otakus.... Wtf...,NoahGetTheBoat,2023-10-09 23:57:31,172uuzp,LoremIpsum_-_,2020-11-07 05:06:37,770.0
k47eemz,Or they just too fucking stupid to realize that iran pays them to fight a proxy war against Israel because iran doesn’t give a fuck about Palestinians either. They pay hamas to attack Israel knowing full well Israel will attack Gaza. And these people are too dumb to know they’re being used.,IsrealPalestineWar_23,2023-10-09 23:56:53,1742ehr,RequirementGlum177,2023-05-04 05:22:50,35867.0
k47e7wu,BIDEN GAVE HAMAS  275 MILLION   JUST  2 YEARS AGO  SO NO WONDER THEY HAVE WEPONS TO KILL THE JEWS,IsrealPalestineWar_23,2023-10-09 23:55:37,1746dvd,Potential-Fix-7515,2021-07-26 23:40:49,3.0
k47e3cw,You seem like a deep thinker.,IsrealPalestineWar_23,2023-10-09 23:54:46,173t6zp,Particular_Theme4870,2022-07-11 23:17:31,3986.0
k47dz9r,WHEN U RAPE AND KILL CHILDREN AND WOAMN   YOUR A TERRORIST,IsrealPalestineWar_23,2023-10-09 23:54:00,173z69z,Potential-Fix-7515,2021-07-26 23:40:49,3.0
k47dv1t,"“Maybe they can drink my grandson pee, it’s very clean”",TerrifyingAsFuck,2023-10-09 23:53:12,171ibwg,uproareast,2013-04-19 18:23:55,21918.0
k47dlfw,That’s what I’m saying - you know there were people trippin balls. I can’t even imagine.,IsrealPalestineWar_23,2023-10-09 23:51:22,173avza,Holiday-Reach-8948,2021-07-08 01:19:12,8042.0
k47dff1,Isreal is the only democracy in the Middle East. In WW2 Hitler killed millions of Jews and they tried to escape and create a new home. The USA promised to provide protection to them and has tried to ever since.,IsrealPalestineWar_23,2023-10-09 23:50:11,1746dvd,InfiniteBid2977,2021-06-22 13:19:14,609.0
k47d8gq,She held on for dear life the second time lol,TerrifyingAsFuck,2023-10-09 23:48:50,173v1k8,No-Bat-7253,2021-11-14 13:41:03,101545.0
k47d64v,"History repeating itself for the millionth time. This is what the world does - war. Apparently, nothing is learned.",IsrealPalestineWar_23,2023-10-09 23:48:23,1746dvd,Holiday-Reach-8948,2021-07-08 01:19:12,8042.0
k47cvge,"Israel and america have deep roots going right back to Israels inception after WW2.  Israel is one of the largest buyers of american weapons.  Israel is far and away, americas strongest ally in the middle east.

Edit:  I am not american or israeli and know very little... the relationship is deep and complex... clearly more nuanced than ive stated above.  But those are the broad strokes, I think.",IsrealPalestineWar_23,2023-10-09 23:46:20,1746dvd,moonmonkey73,2022-11-25 16:42:43,933.0
k47cflx,*Defense from israeli terrorism and massacare of innocents,NoahGetTheBoat,2023-10-09 23:43:16,173nw8f,fiLth_Rat,2020-01-29 15:11:09,52935.0
k47c53b,Bunch of monkeys screaming allah akbar . Kill em all.,IsrealPalestineWar_23,2023-10-09 23:41:17,172kp8p,Sanguinious48,2021-01-30 16:00:49,6849.0
k47bxac,"Get the women and children out, leave the military aged men in. And carpet bomb the shit out of it.",IsrealPalestineWar_23,2023-10-09 23:39:47,174115q,Sanguinious48,2021-01-30 16:00:49,6849.0
k47bgpp,"Remember when they put ""love"" messages on missiles aimed at Palestinians?",NoahGetTheBoat,2023-10-09 23:36:36,173nw8f,weyoun47,2017-07-24 13:25:16,4240.0
k47bdjw,Get the women and children out and just carpet bomb it with all the military aged men still inside.,IsrealPalestineWar_23,2023-10-09 23:36:00,173z69z,Sanguinious48,2021-01-30 16:00:49,6849.0
k47b5pi,Storing weapons there is also a war crime.,IsrealPalestineWar_23,2023-10-09 23:34:30,173lb0j,GuitarSingle4416,2023-03-03 23:07:02,29997.0
k47b4p3,"Day by day oppression, I live in the US, and even though it's a fucked place to live, I've also traveled all over the planet and I have seen that I am blessed and have it so good even thou US is pretty bad,and If my government did to me what the Israeli government did to the muslims i would wage war in a heartbeat, now i wouldnt rape and murder women and childern, but im not sticking up for hamas, im saying Israel has contributed to this death cycle through their oppression, if you are being honest and looking at all angles, Israel is also bad, they have killed innocents by the thousands, created an actual 2nd class citizens with Muslims, and are even starting to attack chirstians, now most Israelis are cool people but it's always the fringe that set an example, and the Israeli government has not cracked down on the alt right groups, I'm not defending hamas brother, I'm calling out the other side, they are both evil, and this will never stop until both sides stop the evil, we all know hamas is evil, many of us don't even know Israel is evil, that's my point.",IsrealPalestineWar_23,2023-10-09 23:34:18,1741xo5,Hopeful-Mech,2023-08-16 14:09:16,11.0
k47b3wq,its all about the money,IsrealPalestineWar_23,2023-10-09 23:34:09,1746dvd,ZhenicalGotLost,2023-09-30 21:00:38,3.0
k47ayx2,I thought my work deadlines were harsh,TerrifyingAsFuck,2023-10-09 23:33:12,173v1k8,Vibranium2222,2021-07-02 17:47:52,327284.0
k47as4f,That would be a warcrime,IsrealPalestineWar_23,2023-10-09 23:31:54,173lb0j,Motor-Baseball-7895,2021-07-24 02:10:27,32.0
k47a9jj,"Most of them probably thought it was part of the show. 
How horrifying.",IsrealPalestineWar_23,2023-10-09 23:28:21,173avza,Italiaroxx,2019-08-07 17:31:47,39737.0
k47a66k,Yeah shockingly enough it does make good propaganda to show your enemy willingly and frequently mass killing children and repeatedly blowing up critical infrastructure that leads to further suffering and death for hundreds of thousands of civilians. Who would have guessed?,NoahGetTheBoat,2023-10-09 23:27:42,173nw8f,wastelandhenry,2016-12-30 08:55:14,34676.0
k479gdb,Military intervention is a lot different then massacring and raping civilian population. when has Israel done anything close to that disgusting stuff??  Sit down brother.,IsrealPalestineWar_23,2023-10-09 23:22:49,1741xo5,[deleted],,0.0
k4798ys,"Can confirm, I never pulled my chute I blacked out haha. But got it the next time.",TerrifyingAsFuck,2023-10-09 23:21:25,173v1k8,white_lightn1ng,2020-10-29 22:54:41,3803.0
k47988n,Gaza = rock quarry!!!,IsrealPalestineWar_23,2023-10-09 23:21:17,172kgpb,Clear_Split_8568,2021-06-11 21:08:24,4492.0
k4795qu,I just gotta say one thing is that the traditional Jewish person does not believe that Jesus was god in human form. Jesus preached the exact opposite of what Israel does. Jesus preached about giving all of you possessions to the needy. The bad part is that gods word has be perverted and there are so many people that are driven by hatred and anger.,IsrealPalestineWar_23,2023-10-09 23:20:48,1744vbi,RevolutionMain4549,2023-09-10 20:18:45,95.0
k478kgo,"Hello, FBI?

This shit right here.",NoahGetTheBoat,2023-10-09 23:16:45,172uuzp,GimmieJohnson,2014-10-12 04:45:45,53910.0
k478gux,Yes the Israeli bombs are guided. They know the yield area of damage. The Palestinians (just Hamas) are firing low income rockets random targets no idea where they gonna go. Hell some landed in Gaza. They have been fighting for thousands of years. It’s in their dna,IsrealPalestineWar_23,2023-10-09 23:16:03,173y2xf,Lablunt420,2023-09-13 12:10:05,0.0
k477wzl,Right!!!!???,IsrealPalestineWar_23,2023-10-09 23:12:20,173y2xf,Lablunt420,2023-09-13 12:10:05,0.0
k476yam,"Now listen to this ;

https://youtu.be/DfR6S_2lj_U?si=S8QcsKTCWTYOlmjH",IsrealPalestineWar_23,2023-10-09 23:05:42,1741xo5,ObviousTelevision575,,0.0
k476xzp,"I guess if you're in Lebanon, this is the really the only thing going for them.",NoahGetTheBoat,2023-10-09 23:05:38,173nw8f,dontnobodyknow,2017-10-10 01:49:45,96545.0
