comment_id,self_text,subreddit,created_time,post_id,author_name,user_account_created_time,user_total_karma
k43ewqe,"I don't understand what this is saying lol

""Civilians are getting attacked, raped and murdered by a terrorist group but they didn't move to a different country when they had the chance so it's on them""

like what the fuck is that",NoahGetTheBoat,2023-10-09 05:32:42,172uuzp,Skenghis-Khan,2020-01-04 18:36:56,48007.0
k43ev8a,"I wouldn't call it creepy. More like terrifying. Imagine being high on drugs, dancing, having a good time and then soldiers are dropping out of the sky, shooting at you killing people around you.",IsrealPalestineWar_23,2023-10-09 05:32:15,173avza,Legitimate-Bass68,2021-09-14 00:05:16,14933.0
k43emkj,"Can't you? It says ""right wingers"" in quotation marks. They're claiming to be the real right wingers mocking the fake ones. In other words, ""no real right winger would support Jews"" kind of shit.",NoahGetTheBoat,2023-10-09 05:29:41,172uuzp,smm_h,2018-09-06 13:59:00,43140.0
k43ejc7,Go troll somewhere else,IsrealPalestineWar_23,2023-10-09 05:28:42,172e4iz,ViolentAnalFister,2023-03-31 18:25:02,1178.0
k43egu2,"He gets to retire and get studded out full time, the lucky bastard",CrazyFuckingVideos,2023-10-09 05:27:56,172mfyf,lsdiesel_1,2015-04-30 23:46:27,84407.0
k43eag4,"Let's put it this way.

Some aeas deep into Ukraine are already populated by Russians. A few days ago i saw some of those areas getting bombed by Ukrainians. Did the civilians not have it coming, deciding to live on occupied land?

Sure the kids are clueless, but didn't the adults make a semi-conscious decision to continue to live where exactly these crimes were always a possibility and even a promise?",NoahGetTheBoat,2023-10-09 05:26:01,172uuzp,smm_h,2018-09-06 13:59:00,43140.0
k43e86j,I’d say he isn’t the pest they’re worried about but I feel like the pilot might disagree,CrazyFuckingVideos,2023-10-09 05:25:20,173e6bt,dapperd0n,2013-02-11 04:11:50,9687.0
k43e3ts,Iran / Russia,IsrealPalestineWar_23,2023-10-09 05:23:59,173hwub,pooppantsredditmod,,0.0
k43dy54,"That commenter is mistaken, there are many copies of AK47’s in Russia allied countries that aren’t made by Russia. E.g. The Type 56 made in China, the Maadi from Egypt, amd the Romanian PM md 63 and 90 (which are often those that you see with a front foregrip), the M70 from Yugoslavia and the Type 68 from North Korea",IsrealPalestineWar_23,2023-10-09 05:22:16,173hwub,roasterben,2017-07-10 11:58:44,20645.0
k43dv9b,Some are religious,NoahGetTheBoat,2023-10-09 05:21:24,172uuzp,smm_h,2018-09-06 13:59:00,43140.0
k43d6bm,https://preview.redd.it/tjwcfv0424tb1.png?width=1080&amp;format=pjpg&amp;auto=webp&amp;s=0ede95e8a08d2aa0823d0a9eb05b5d171fb03d21,TerrifyingAsFuck,2023-10-09 05:13:53,173c01i,minotaur0us,2021-05-13 03:25:45,21172.0
k43d5ox,"https://preview.redd.it/f3uw2fr224tb1.jpeg?width=853&amp;format=pjpg&amp;auto=webp&amp;s=c0bf07f6bae9556b5b6cce8688f3f27cd2539590

Do you know this toddler? Two years old, Mohammad Tamimi. Ever heard of him?",TerrifyingAsFuck,2023-10-09 05:13:42,173c01i,tehzulx,2016-06-07 16:11:23,6117.0
k43d1ir,And? Your point is...,TerrifyingAsFuck,2023-10-09 05:12:27,173c01i,tehzulx,2016-06-07 16:11:23,6117.0
k43cydy,Basically a Jewish nationalist,IsrealPalestineWar_23,2023-10-09 05:11:31,1738q8z,chunka101,2020-08-19 12:01:35,290.0
k43ciz1,"Lmao, all these 5-10 year old videos about israel being spammed on reddit the past 2 days trying to change the narrative. Iran as bot accounts all over reddit.",TerrifyingAsFuck,2023-10-09 05:06:59,173c01i,longteethjim,2015-03-26 01:55:50,5573.0
k43axbt,Afghanistan via Iran. They used some weapons that were abandoned by the US after it withdrew.,IsrealPalestineWar_23,2023-10-09 04:50:24,173hwub,Lazy_Transition2483,2023-05-05 20:30:14,87.0
k43ared,Ooh boy!,IsrealPalestineWar_23,2023-10-09 04:48:44,172khi5,Due-Crazy-5398,2021-08-01 19:23:32,12021.0
k43aldd,"Who cares about someone laughing now about something from 80 years ago WHEN THIS FUCKING WEEKEND 700 civilians were slaughtered by Hammas , 260 of them whole partying in a fucking music festival outdoors .

You're talking to me about history of almost a century ago vs something that is happening right now .",TerrifyingAsFuck,2023-10-09 04:47:02,173c01i,Klayhamn,2007-12-20 11:34:40,19662.0
k43ajjx,"But they're on israel side, but yea it has history of double dealing i think..",IsrealPalestineWar_23,2023-10-09 04:46:31,173hwub,TotalEquivalent6250,2021-12-07 14:16:39,695.0
k43afet,Well then Fuck IDF too. They are killing kids for fucks sake.,NoahGetTheBoat,2023-10-09 04:45:24,172uuzp,vector79,2015-12-04 17:11:44,20636.0
k43aem6,If it's true. I don't think it's directly sold from Russia.,IsrealPalestineWar_23,2023-10-09 04:45:10,173hwub,TotalEquivalent6250,2021-12-07 14:16:39,695.0
k43a0is,"they were celebrating a holiday in Isreal, how creepy being at a festival and bombs go off and all the sudden foot soldiers start charging shooting guns",IsrealPalestineWar_23,2023-10-09 04:41:13,173avza,Interesting_Rush570,2020-11-14 02:03:04,2114.0
k439yki,Most of the west support the terrorist state of Israel so I don't understand whats the point your trying to make,NoahGetTheBoat,2023-10-09 04:40:40,172uuzp,elganjaescobar,2018-08-19 11:47:54,6344.0
k438nvu,"You don't get to compare the size of atrocities when it is the same thing. 

That's what NO means you dumb fkk. 

Both sides have people killing people because they have been seeing this since they were born. V

Grow the fck out of your comfort bed. The world is not that simple. Israel is not the good guy here. Neither is Hamas.",TerrifyingAsFuck,2023-10-09 04:27:49,173c01i,rcorum,,279.0
k438i5z,"They were pissed at the Palestinians in the 1940s, the Grand Mufti of the Palestinians during WW2 praised Hitler's final solution and encouraged other Middle Eastern countries to follow suit. Even for years prior there had been attacks against the Jews living in Jerusalem.

So there was really no love lost when Israel established itself as its own country.",TerrifyingAsFuck,2023-10-09 04:26:14,173c01i,BATHR00MG0BLIN,2019-09-19 01:36:47,44960.0
k438e8t,It’s from a documentary about the [Tantura](https://m.imdb.com/title/tt16378034/).,TerrifyingAsFuck,2023-10-09 04:25:10,173c01i,Eddyzodiak,2020-10-18 02:15:34,114650.0
k438a8y,"So does that excuse him laughing about he did with his buddies? 

So if I shot someone’s kid 10 yrs ago and they comeback and massacre my father, mother, brother, kids and innocent bystanders does that give me a free pass just cause their murders are worse?",TerrifyingAsFuck,2023-10-09 04:24:04,173c01i,Eddyzodiak,2020-10-18 02:15:34,114650.0
k4389wq,"They slaughtered 260 teenagers in a music festival .
They slaughtered and kidnapped families : men, women, children and elderly in their and from their homes - around another 550.

What do mean by ""no ""-fucking imbecile ?",TerrifyingAsFuck,2023-10-09 04:23:59,173c01i,Klayhamn,2007-12-20 11:34:40,19662.0
k437y7a,"They and their buddies (accomplices) escaped and got to live their lives with no consequences. 

It’s like, for example, you and your buddies rob all the banks in town  and are never caught so the banks take measures to prevent such from happening. The newer generations never had the chance so it’s only the old guys who talk about it.",TerrifyingAsFuck,2023-10-09 04:20:50,173c01i,Eddyzodiak,2020-10-18 02:15:34,114650.0
k437tmh,Isn't that pest control being sprayed? Aren't thry breathing that vapor?,CrazyFuckingVideos,2023-10-09 04:19:38,173e6bt,XxTreeFiddyxX,2015-08-06 17:39:55,144728.0
k437lgg,"Because as history has shown, Israeli soldiers that commit atrocities in Palestine often don’t have to face the consequences of their actions",TerrifyingAsFuck,2023-10-09 04:17:26,173c01i,MexicanTeenGuy,2017-07-09 10:51:35,13148.0
k437kdu,"Legit talking about a German peace activist like she fucking deserved to get raped and murdered is evil

Yeah I'm sorry these people are just not fixable",NoahGetTheBoat,2023-10-09 04:17:08,172uuzp,ThePhantomMenaceV,2023-10-07 11:45:03,191.0
k43742o,"These are Russian made weapons AK-47’s, RPG’s are all Russian origin.",IsrealPalestineWar_23,2023-10-09 04:12:42,173hwub,InfiniteBid2977,2021-06-22 13:19:14,609.0
k4370o0,No,TerrifyingAsFuck,2023-10-09 04:11:49,173c01i,rcorum,,279.0
k436tr7,Didn’t know this fact as someone who watches soccer a few times a year and both world cups. but taking a second to think on it soccer (I’m American) players probably do the most cutting (changing directions) out of any sport with maybe basketball being the 2nd highest an even Acl tears aren’t that common.,CrazyFuckingVideos,2023-10-09 04:10:00,172mfyf,Oohhdatskam,2018-12-15 06:13:58,10937.0
k436hzj,"What Hammas just did this weekend is x10 times worse in scale, and you're here talking about an atrocity committed almost 8 decades ago.

You're a fucking moron.",TerrifyingAsFuck,2023-10-09 04:06:56,173c01i,Klayhamn,2007-12-20 11:34:40,19662.0
k436czo,"Iran, who got the weapons from the US of A",IsrealPalestineWar_23,2023-10-09 04:05:36,173hwub,Only-Photo-4871,2023-05-08 10:28:22,12.0
k4369cw,"So, they're so pissed off that they decided to slaughter 260 civilians at a music festival?

[https://www.youtube.com/watch?v=rIIzsW4FAGo](https://www.youtube.com/watch?v=rIIzsW4FAGo)",TerrifyingAsFuck,2023-10-09 04:04:38,173c01i,Klayhamn,2007-12-20 11:34:40,19662.0
k4364kx,everything that is described there is dwarfed by what Hamas just committed.,TerrifyingAsFuck,2023-10-09 04:03:24,173c01i,Klayhamn,2007-12-20 11:34:40,19662.0
k435ud8,🇺🇸,IsrealPalestineWar_23,2023-10-09 04:00:48,173hwub,Repulsive_Worth4905,2021-10-07 23:58:33,3098.0
k435mg1,"We're watching true monsters talking about the atrocities they did, like it was an episode of One Piece they watched yesterday.

Smiling, laughing, talking about people like they were just insects... I can't believe how detached those monsters are, they simply don't give a damn.",TerrifyingAsFuck,2023-10-09 03:58:46,173c01i,esoares,2010-12-27 18:40:29,55503.0
k4356y4,Iran,IsrealPalestineWar_23,2023-10-09 03:54:49,173hwub,Kingslayer-5696,2023-01-30 21:10:52,966.0
k4355gw,How do we know this is real? Why would soldiers admit war crimes on camera?,TerrifyingAsFuck,2023-10-09 03:54:27,173c01i,mcmur,2011-06-03 02:13:01,66835.0
k434zbi,"Dont send water, send flames noah.",NoahGetTheBoat,2023-10-09 03:52:54,172uuzp,SionJgOP,2015-09-16 13:20:18,22796.0
k433tcp,"Ahh when the oppressed become the oppressors and the abused become abusers

Israel have relied on their painful history and utilised the world's sympathy and guilt to do the same to the Palestinians what was done to them. 

I know that after the War Europe was desperate to relocate the surviving Jewish people, somewhere safe,  but with hindsight they didn't really think through the long term repercussions of breaking up some fairly barren land from the indigenous population and creating an Israel surrounded by Muslims",TerrifyingAsFuck,2023-10-09 03:42:31,173c01i,[deleted],,0.0
k4331ls,Why is it always old people the biggest pieces of shit? And they said its the youth whats wrong with the world.,TerrifyingAsFuck,2023-10-09 03:35:42,173c01i,PaleFollowing8752,2023-08-01 01:33:19,175.0
k430f3k,"Did she really have an onlyfans tho? 

Asking for a friend",NoahGetTheBoat,2023-10-09 03:13:50,172uuzp,CalligrapherBest9196,2023-04-15 09:49:56,100.0
k43039w,The same happened last week...but this time 200+ Palestinian victims ... Imagine that happened to one of your family numbers what you will do be honest?,TerrifyingAsFuck,2023-10-09 03:11:10,173c01i,lowft-u,2022-01-05 03:34:11,5337.0
k42zvl0,"This was exactly my take. People with brain diseases, hallucinations, schizophrenia and run of the mill diagnoses these days didn’t have any solutions or ideas about why people were the way they were. 


They were just the weird kid. That was pretty much it. There were no 504’s etc. Everyone was in a classroom together except the “special” kids. That was it. No one on one, special teachers or accommodations. 


Later in life, they were the weird uncle who held odd jobs and never married, or the lady who has worked at Target for 20 years and is still a cashier. I personally know a guy who would have been diagnosed with something but we were in a small town and therapists were kept hush hush back then. 


We were FWB in high school and shortly after then lost touch. I saw him about 5 years later at a gay club in the city.  Not super surprised the gate swung both ways. 


Fast forward 20 years and I heard he’s a member of the Proud Boys. Weird, but not surprised. Incel, closet gay,etc. Weird how people we thought would be friends forever are now waaaay in the rear view mirror.",TerrifyingAsFuck,2023-10-09 03:09:31,171ibwg,Triviajunkie95,2016-03-18 01:30:22,64888.0
k42zsao,This is one the more nauseating things I've read... and I've read the Bittaker/Norris transcript multiple times.,NoahGetTheBoat,2023-10-09 03:08:48,172uuzp,muhguel,2022-12-08 01:48:49,1143.0
k42z16a,Exactly!  How dare that combine be in its field doing its harvesting thing.  Its not like he had a whole sky to fly in like that guy.  Dang farmers I tell ya.  Start seeing by planes while on your combine people!,CrazyFuckingVideos,2023-10-09 03:02:59,173e6bt,muhsqweeter,2023-05-19 03:46:59,19631.0
k42whh7,In theory it’s anyone who wants a Jewish state for protection of Jewish people from an oppressive majority. In practice it’s people that support the modern state of Israel and wish to continue its apartheid.,IsrealPalestineWar_23,2023-10-09 02:44:24,1738q8z,poundmycake,2016-04-26 23:41:48,16964.0
k42vw2f,"Yes, this guy was definitely complicit in downing people in cages and blowing up captives with artillery pieces like ISIS did. He's EXACTLY like ISIS by describing the horrible things he saw other people do — as we can see in the video he's obviously very proud of what his comrades in arms did



Are you about to tell me the things this 80 year old man saw justifies what Hamas did yesterday?",TerrifyingAsFuck,2023-10-09 02:39:50,173c01i,Cpotts,2011-05-19 01:56:58,106652.0
k42vup7,"Honestly, even as someone who’s struggled with anger due to a complete lack of success with certain women post-college and with online dating in general, this level of vitriol is both baffling and more than a little frightening. Kinda seems like some of these guys were going to become monsters even if they had gotten laid a bunch of times. Just wtf.",NoahGetTheBoat,2023-10-09 02:39:33,172uuzp,CampCounselorBatman,2015-09-17 03:01:16,89104.0
k42vu9u,It crazy that people defending those animals and say they laughing because they sad wtf the Media did to your Brian,TerrifyingAsFuck,2023-10-09 02:39:28,173c01i,lowft-u,2022-01-05 03:34:11,5337.0
k42vgpy,"Oof... I don't even know how to begin breaking the news for you. Maybe this infographic using UN's data:

(I didn't save it dang it hold on I will go get it)

EDIT: there it is, I feel like a dingus for not making sure I had it saved before.

https://preview.redd.it/155j5doba3tb1.jpeg?width=1079&amp;format=pjpg&amp;auto=webp&amp;s=38499b09a132a9294f17701ac68aea242caf3550",TerrifyingAsFuck,2023-10-09 02:36:40,173c01i,MisteriousRainbow,2022-07-28 18:41:36,66244.0
k42vdvi,Bruuh replace it with ISIS member and let see if you say the same,TerrifyingAsFuck,2023-10-09 02:36:04,173c01i,lowft-u,2022-01-05 03:34:11,5337.0
k42v6dw,"And even those that live in the country... not all of them support what it did and does to Palestinians, many just happen to have been born there. Just like not everyone who defends that Israel's crimes are recognized and punished, and that the Palestinians have their rights recognized and granted, supports what Hamas did yesterday. 

The concept of every human being having their rights protected and every form of violence against civilians should be condened shouldn't be a shocking hot take, yet here we are...",TerrifyingAsFuck,2023-10-09 02:34:35,173c01i,MisteriousRainbow,2022-07-28 18:41:36,66244.0
k42ui2t,"Jewish people who oppose Israel's past and present attrocities against the Palestinians aren't to blame for it, just like how US citizens who protested the many imperialistic actions of the country they live in are not to blame for them, just like how German citizens who (at least tried/died trying to) opposed Hitler or hid persecuted people in their homes aren't to blame for the Holocaust. 

People who did what was within their reach to protest and fight attrocities committed by their country, by an entity they are connected to by mere chance of location of their birth, are not to blame for those attrocities. They did their best to prevent them, and while it is a shame that many times their best wasn't enough, the blame it is not theirs, but of those that failed to oppose the attrocities or at least not support them.",TerrifyingAsFuck,2023-10-09 02:29:41,173c01i,MisteriousRainbow,2022-07-28 18:41:36,66244.0
k42ti9b,"He seemed disturbed by it all and is nervously laughing because that's what people do when they are uncomfortable.



Also the timing of this upload? Is OP trying to justify what happened yesterday?",TerrifyingAsFuck,2023-10-09 02:22:27,173c01i,Cpotts,2011-05-19 01:56:58,106652.0
k42sshv,"&gt;its not that he’s a bad person

well they did what they did, it's likely the bad person judgement comes from being a mass murderer of innocent women and children and who knows what else - the laughing is just the terrifying cherry on top

im sure no one mandated they rape a 16 year old or take a flamethrower to citizens",TerrifyingAsFuck,2023-10-09 02:17:08,173c01i,KyronXLK,2018-04-03 02:15:05,55397.0
k42q4hw,🤣🤣,CrazyFuckingVideos,2023-10-09 01:57:27,172mfyf,Dustpan-Man,,86.0
k42owil,Watch Isreal commit more war crimes. Isreal is fucking 😈  most Americans know this!they stole Palestinians lands and slaughter them for decades now. It's disgusting!,IsrealPalestineWar_23,2023-10-09 01:48:32,172e4iz,nodsquad224,2022-11-04 23:28:55,1.0
k42oloa,"The first one refers to the Tantura massacre 1948, [see the wiki article here.](https://en.wikipedia.org/wiki/Tantura_massacre)

It's ironical that these guys ended the same way like the Nazis did only a few years before in WW2. The massacre could also have been carried out by some Waffen-SS units.

But about the ""joking"", it's often a form of coping with humor. Met some WW2 vets and once i asked one about why he's joking about such a serious thing, he told me: ""If i'd not joke about it and cope with humor, i'd go insane"".

But i also saw this in other cases, like when people talk about traumatic accidents, they are often not that much affected in the first place because they learned how to cope with it. Like my ex gf lost her leg in an accident and she has no problems to tell the story, it's not like that this would be a mental breakdown for her.

Don't get this wrong, i don't side with anyone in this conflict there. It's always wrong to kill civilians and also POW's, soldiers that surrendered and didn't fight anymore.",TerrifyingAsFuck,2023-10-09 01:46:20,173c01i,Diacetyl-Morphin,2021-01-16 16:22:55,252237.0
k42oinr,🇮🇱🐷,IsrealPalestineWar_23,2023-10-09 01:45:45,172kfr9,1NIVEK,2022-10-18 06:07:36,288.0
k42ocgc,That's a harsh and bold statement. Bet you wouldn't say that to his face.,TerrifyingAsFuck,2023-10-09 01:44:29,173c01i,Orea1981,2019-07-01 13:25:28,13803.0
k42nt38,"I know I'm a piece of shit for this, but I really want to patch that Caprice up and put it on some factory rims. Such a clean car, or at least it was...",TerrifyingAsFuck,2023-10-09 01:40:37,172vng0,Anonymous_Toxicity,2023-01-10 01:08:52,26641.0
k42ne44,I thought he was faking it at first. Lol. Then I saw the floppy foot.,CrazyFuckingVideos,2023-10-09 01:37:35,172mfyf,Papichurro0,2021-03-14 00:24:51,20239.0
k42mwkp,Welcome to Richmond mf!,TerrifyingAsFuck,2023-10-09 01:34:03,172vng0,mikeysgotrabies,2019-06-25 05:12:49,90443.0
k42mupo,Terrorist,IsrealPalestineWar_23,2023-10-09 01:33:41,172kfr9,United_Detective6043,2020-09-20 22:19:27,21.0
k42ltt2,"Bro I can't stand religion 99.9999% of the time and I don't live in the never ending warzone sandbox so I could care less who actually ""owns"" it. I didn't even know what ""Zionist"" meant until 2 seconds ago when I just googled it. 

That being said hop off of the ""supporting Hamas terrorism"" dick. It's not a good look. Regardless of who it is, doing that shit to civilians is not acceptable. 

Anyways if this was about Palestinian women it would be just as bad. Hate towards any group of people based solely on their nationality, religion, sexuality, race, etc is never okay.",NoahGetTheBoat,2023-10-09 01:26:06,172uuzp,NotTheAverageAnon,2022-06-14 00:13:33,43383.0
k42lkym,"No, but people on the left have already defended Hamas.",NoahGetTheBoat,2023-10-09 01:24:18,172uuzp,EverySingleMinute,2019-09-28 05:46:43,81520.0
k42l34f,"This has nothing to do with pro or against Palestine. Go to Twitter and see US and isaezli politicians calling for genocide. This post is pure hatred for women, they would say the same any women victims in any part of the world.
What an effing strawman you throw, zionist!",NoahGetTheBoat,2023-10-09 01:20:39,172uuzp,yazen_,2015-06-11 08:16:10,59448.0
k42kkc1,Thank you for the explanation!,IsrealPalestineWar_23,2023-10-09 01:16:55,1738q8z,valmirettm,2022-07-02 06:20:57,239.0
k42jk61,"people use humor to mask trauma. its not that he’s a bad person, its that it’s easier to laugh at the unimaginable evil you, a soldier, were used for, than to confront them. 
humor got me through afghanistan but i’ll lie if i say i dont cry about it too.",TerrifyingAsFuck,2023-10-09 01:09:47,173c01i,saltdealer,2017-08-22 01:40:17,2801.0
k42hz1n,Fucking rabid animals. Put them down,IsrealPalestineWar_23,2023-10-09 00:58:23,172kgpb,Particular_Theme4870,2022-07-11 23:17:31,3986.0
k42gijn,Obviously the harvester should have moved out of the way.,CrazyFuckingVideos,2023-10-09 00:47:42,173e6bt,hallbuzz,2009-10-09 23:25:16,103428.0
k42fopl,"&gt;Also isn't every single Jew in the world afforded Israeli citizenship? All they need is a plane ticket. Doesn't that make all the Jews somewhat implicit in Israel's pretty brutal treatment of the Palestinians?

Your logic makes no sense. While every Jewish person is eligible to become an Israeli citizen, it's important to recognize that not all of them necessarily want to live in Israel or support the idea of the country.",TerrifyingAsFuck,2023-10-09 00:41:40,173c01i,RetardedAcceleration,2013-10-19 20:15:24,35971.0
k42e24o,The original post image is the most fucked up shit ive ever seen in my life. holy fucking shit.,NoahGetTheBoat,2023-10-09 00:30:07,172uuzp,f1nessd,2018-12-27 15:40:21,134124.0
k42dx93,Play stupid games …,CrazyFuckingVideos,2023-10-09 00:29:09,173e6bt,GreenFish2319,2020-11-02 08:24:01,267.0
k42ceq8,"No, that's hummus. Hamass is a car that is really bad with fuel economy.",NoahGetTheBoat,2023-10-09 00:18:10,172uuzp,SumYumGhai,2018-10-20 19:52:12,34425.0
k42c9vn,Harrassment,NoahGetTheBoat,2023-10-09 00:17:12,172uuzp,NoahGetTheBoat-ModTeam,2022-08-25 19:53:16,-99.0
k4298mz,"Reminds me of interviews with japanese ex-soldiers that commited atrocities back in WW2. They were the exact pos that did it and not talking about their comrades. They were laughing and smiling while talking about it with glee.

Unrelated but there was a post on reddit that is a screenshot of a post written by one of the pos that tortured Junko Furuta. The pos is alive and active on social media like the rest of us as if it did nothing wrong because of ties with the mafia, and the post was about the pos trying to justify its actions.",TerrifyingAsFuck,2023-10-08 23:55:00,173c01i,Hallucinationistic,2019-06-03 14:27:26,4832.0
k4292yb,"If it's any consolation, each and every one of them will die alone.",NoahGetTheBoat,2023-10-08 23:53:50,172uuzp,siphillis,2012-04-02 13:48:43,852462.0
k428zae,"To them, any woman who isn't a viable sexual outlet is already worthless.",NoahGetTheBoat,2023-10-08 23:53:05,172uuzp,siphillis,2012-04-02 13:48:43,852462.0
k428x68,Nothing terrifying about some make believe religious ghosts,TerrifyingAsFuck,2023-10-08 23:52:39,171ibwg,CommissionGrand4087,2023-03-05 17:23:24,4456.0
k428n6m,Ex-Israeli soldier describes atrocities committed against Palestinians.  New headline,TerrifyingAsFuck,2023-10-08 23:50:37,173c01i,elseworthtoohey,2018-08-27 14:26:52,13437.0
k427b5d,"No, I'm not. You're telling me, who has never been to Israel and never wants to, that I'm responsible for the fucking IDF? Yes, that's an antisemitic opinion. Own it or self-reflect.",TerrifyingAsFuck,2023-10-08 23:40:51,173c01i,rybnickifull,2020-02-07 13:44:41,82138.0
k4276mr,"I think you are just trying to do character assassination to my reddit account because you very strongly disagree with me. Wouldn't you say all Americans are at least somewhat implicit in the war crimes we committed from like Vietnam up? I do definitely. Once we figured out weapons of mass destruction were a lie in Iraq for example, anyone still on board with it is partially guilty. edited for context",TerrifyingAsFuck,2023-10-08 23:39:56,173c01i,Agreeable-Lie-6867,2021-01-20 05:36:08,292.0
k426zgi,"No, it doesn't. Happy to help, and you seem to think things about yourself that aren't true. 'All Jews are responsible for Israel' is like, Antisemitism 101, up there with 'they're all rich'.",TerrifyingAsFuck,2023-10-08 23:38:30,173c01i,rybnickifull,2020-02-07 13:44:41,82138.0
k426y2w,"""You're better off askin Ariel Sharon for compassion, you're better off beggin for 20 points from a label, you're better off battling cancer under telephone cables"" - Immortal Technique",TerrifyingAsFuck,2023-10-08 23:38:14,173c01i,Psychological_Help99,2021-02-08 12:51:14,613.0
