comment_id,self_text,subreddit,created_time,post_id,author_name,user_account_created_time,user_total_karma
k4hr0el,Hopefully religion will end religion,NoahGetTheBoat,2023-10-11 23:59:21,175ofdt,eatpotdude,2021-11-11 01:32:39,58042.0
k4hq6wy,"Lol, unbiased? The Palestinian arabs are the closest living descendents of the original palestinian people who held the region for millenia. Also the name Palestine  precedes the romans by a quite a bit. Herodotus an ancient greek historian/geographer named the region as  Palaistínē from the 5th century BC, that is \~500 years before any roman influence on the region. Even the jewish texts have a name for the region as Pelesheth. Israeli attempts at downplaying palestinian history is literally just a justification for their colonial behaviour.

You forgot to mention that in the precursor to the first Israeli-Arab war, 700,000 palestinians were displaced and expelled from their ancestral lands into arab lands by zionist militia which the arabs call nakba. The israelis did have some legitimate concerns initially since they thought the second holocaust was about to happen but what the war evolved into was just an expansionist state with their form of manifest destiny. Those children of Nakba are still stateless which is considered a human right violation.

Also you talk about how much money the palestinian people recieve in aid. You forget to mention that Israel has enforced a blockade on them for years denying them access to amenities like water, electricity and food. Israel doesn't even allow desalination plants in occupied west bank where 97% of water in occupied territory is toxic. Talking of money, the US has given over $250bn for Israel and all of that money is for weapons and missile defence systems. Israel an OECD nation is considered one of the top reciepients for american aid.

The funniest part is ""Israel has been extremely forgiving"". Due to the occupation and blockade, the median age in gaza is 18. 40% of them are 14 or younger. When Israel has started indiscriminately bombing buildings, they are killing kids. What a funny concept, a warning missile. I wonder how many people would hear a missile hit their property and then think, yes this is actually the warning missile. They are taking down civilian infrastructure like telecom companies and then claiming that they can phone people to warn them in advance.

Just remember that for the last 5 decades, the UN has tried to pass resolutions critical of Israel over 53 times, and every single time gets vetoed by America who encourages Israel's actions. Ultimately its not good that civilians are getting killed, and I'm sure as this drags on, casualties will pile up on both sides. However the western media will never cover Israel's warcrimes and will just hyperfocus on Hamas and demonize palestinians.",IsrealPalestineWar_23,2023-10-11 23:53:45,175n0fz,Needyandweedy,2017-12-21 20:43:43,982.0
k4hny33,"Caused by 6.8 earthquake in 1815.
Tried to find this in the comments, but failed, so...",TerrifyingAsFuck,2023-10-11 23:38:31,174pwu2,Curious-Education-55,2022-10-06 16:36:52,984.0
k4hnrvg,"The Palestinians have harboured terrorists like Hamas in Gaza for Decades. Its time to clean out the nest. 

At least Israel sent text messages to the civilians to leave, even after Hamas slaughtered Israelis.",IsrealPalestineWar_23,2023-10-11 23:37:21,173z69z,Hot-Hatch82,2023-04-12 20:44:43,-5.0
k4hkdyw,"Everyone should be Bhuddist, problem solved",IsrealPalestineWar_23,2023-10-11 23:14:15,174wf1h,weedyneedyfeedy,2021-06-18 11:04:20,13956.0
k4hjqf0,Religion will be the end of us,NoahGetTheBoat,2023-10-11 23:09:43,175ofdt,Hippie11B,2013-10-03 07:03:15,169724.0
k4hiptz,Aww bless your heart. Trying your best to make those mental gymnastics work.,IsrealPalestineWar_23,2023-10-11 23:02:45,1744vbi,sleepy-broccoli,2023-05-30 18:56:22,348.0
k4hhmak,israel keeps giving the muslims more chances to cause more chaos,NoahGetTheBoat,2023-10-11 22:55:23,175ofdt,daddy_ubi,2020-03-06 15:15:03,2167.0
k4hhlla,"Listen to 178. Israel At War by The Rest Is Politics on Audible. https://www.audible.co.uk/pd/B0CKRX6GN8?source_code=ASSOR150021921000V


I think this podcast is pretty unbiased and sums up some of the reasons",IsrealPalestineWar_23,2023-10-11 22:55:15,175n0fz,Training-Window-9111,2021-06-17 22:53:08,677.0
k4hh37z,It's very impressive how most of these missile strikes destroy the target building without really destroying anything else around it.,IsrealPalestineWar_23,2023-10-11 22:51:43,175frk9,Legitimate-Bass68,2021-09-14 00:05:16,14933.0
k4hh2xf,"Not a doctor here, thats not supposed to happen",TerrifyingAsFuck,2023-10-11 22:51:40,174lrdl,Intrepid_Stuff_9944,2021-09-09 10:37:17,5426.0
k4hgsfr,"It amazes me how you can have all the information IN FRONT OF YOU, and you STILL can't see it...

I clearly state that their caption is obviously wrong (do you see the words ""obviously wrong"" in parentheses?). And by it being wrong, they are suggesting a false version of the event. I'm stating the false meaning they're inadvertently suggesting by using incorrect wording in their caption. I'm lamenting that they made such an obvious mistake. Their caption says the plane is pictured seconds BEFORE colliding, while the picture clearly shows it seconds AFTER colliding (or rather the moment OF collision). By suggesting that what we're seeing in the picture is the B-17 seconds BEFORE it collided, it suggests (falsely) that the plane broke up in midair on its own, BEFORE the collision. I know they did not MEAN to suggest this, but by mistakenly using the word BEFORE instead of AFTER, they have misrepresented the event. Do you understand now? You're the only one not getting this. I got many upvotes. Everyone else understands.

\*If we're going to belabor this further, I strongly suggest we spare these kind people our bickering back &amp; forth, and take this discussion to direct messages. Please engage with me there, if you must.

&amp;#x200B;

Thanks.

\-ACSF",TerrifyingAsFuck,2023-10-11 22:49:43,174hw6w,ArmchairCriticSF,2017-05-17 16:15:22,23633.0
k4hge1o,"If you weren't so stupid (and you are in this case), you would know better!

I just watched him give a press conference where he talked about how hard his administration is working to make sure that as many people on earth as possible can find peace. He didn't look too sleepy to me.

The last thing he said was that he wouldn't be taking any questions himself,  but that his staff would answer as many questions as possible after he left.

One person in the crowd responded.  At first, I thought it was another moron asking another stupid question.  But when we were finally able to hear him, he was thanking the president for his great leadership ability and for his love for humanity. 

The whole crowd erupted in applause.   I just cried. 

Pay more attention!",IsrealPalestineWar_23,2023-10-11 22:47:01,175fxy9,Worldly_Catmac_1953,2023-08-07 00:11:57,-7.0
k4hgaer,Pride made the devil,IsrealPalestineWar_23,2023-10-11 22:46:19,1744vbi,OrganicExperience636,2023-01-09 11:55:05,21.0
k4hez8e,This would never have happened if they had stronger gun laws,IsrealPalestineWar_23,2023-10-11 22:37:15,173gu61,Tall-Big4230,2022-02-28 23:19:12,186.0
k4hef1c,Because each side says god gave them the land,IsrealPalestineWar_23,2023-10-11 22:33:24,175n0fz,Traditional_Arm_4190,2022-11-03 02:49:22,205.0
k4hdyw9,"https://preview.redd.it/pj2d1f8ugntb1.jpeg?width=828&amp;format=pjpg&amp;auto=webp&amp;s=e1774c0cb82ade2d3c47d447b8580b9c0eea66be

Verbatim dude",TerrifyingAsFuck,2023-10-11 22:30:22,174hw6w,higzbozo,2018-09-16 00:26:41,4773.0
k4hdeo6,"Let me be the judge of what I wanna see.  If you have a link, share please",IsrealPalestineWar_23,2023-10-11 22:26:38,175cw72,toosmoov536,2018-03-09 02:33:19,44.0
k4hd5ns,I agree.  Everyone seems to taking a side when neither side is in the right here.   Both sides appear to have zero regard for human life and just try to one up each other on how low they can go.,NoahGetTheBoat,2023-10-11 22:24:57,175ofdt,donamese,2019-08-02 22:38:48,35032.0
k4hczz7,https://news.sky.com/story/why-is-there-tension-between-muslims-and-jews-over-jerusalem-holy-site-12851947,IsrealPalestineWar_23,2023-10-11 22:23:52,175n0fz,pioneergirl1965,2022-09-17 02:37:30,17021.0
k4hc3dk,"I don't really think it's possible to look at it unbiased, it really just depends on where you fall and what you think is right. If you don't think Israel should be allowed to exist, which you are allowed to believe, you might support the Palestinians, but if you believe the Jews deserve to live in their original lands, which you are also allowed to believe, then you would support Israel, and there's so many other factors like previous battles between them that factor as well.",IsrealPalestineWar_23,2023-10-11 22:17:56,175n0fz,Communism_is_wrong,2020-11-04 07:32:50,4266.0
k4hbqmn,"You should be thanking the American taxpayers for buying the iron dome, not sleepy old Joe. Hes probably sleeping right now lol.",IsrealPalestineWar_23,2023-10-11 22:15:37,175fxy9,Communism_is_wrong,2020-11-04 07:32:50,4266.0
k4hah09,"No, I didn’t. Read it again.",TerrifyingAsFuck,2023-10-11 22:07:23,174hw6w,ArmchairCriticSF,2017-05-17 16:15:22,23633.0
k4ha2lb,Seems that Israel has better Technic to take buildings down with rockets than Russia,IsrealPalestineWar_23,2023-10-11 22:04:45,175frk9,Adventurous_You_2118,2022-02-02 14:41:00,27.0
k4h9tor,"Nah dude, you very clearly stated the article claimed the plane fell apart in mid air. It doesn’t.",TerrifyingAsFuck,2023-10-11 22:03:08,174hw6w,higzbozo,2018-09-16 00:26:41,4773.0
k4h9gz9,"Nah.  The farthest back this goes is the founding of islam.  Muhammed HATED jews, though not initially.  He had tried to establish his own religion in his hometown, they kicked him out (religions were a way of making money).  He goes to Medina I think it was, where he tried to convince the christians and jews THERE that he was a prophet on par with Jesus, they didn't like that and kicked him out, the jewish community was in particular hostile to the idea.  
So while initially ""people of the book"" had a form of protection, he later rescinded that before he died and said if they don't submit and convert or pay tax, christians and jews were also to die.",IsrealPalestineWar_23,2023-10-11 22:00:51,175n0fz,Worldsprayer,,335.0
k4h8up8,Fuck your god if u do this,IsrealPalestineWar_23,2023-10-11 21:56:53,174sebr,Tall-Big4230,2022-02-28 23:19:12,186.0
k4h8lyf,"Ironically what I find so many people didn't know that when Israel fires a missile they fire a warning signal 3 to 10 minutes before they actually fire a missile into Palestine. But why does Hamas not give a warning sign to Israel? I did leave a comment but I feel that this war goes back to Abraham because Ishmael is the descendant of the Arab people and Isaac is the descendant of the Jewish people and they've been fighting this war since Abraham was alive all because Sarah could not get pregnant and therefore Abraham impregnated the Egyptian maid named Hagar, ironically then Sarah Abraham's wife gets pregnant and the two boys have fought for was fair between the two of them",IsrealPalestineWar_23,2023-10-11 21:55:22,175n0fz,pioneergirl1965,2022-09-17 02:37:30,17021.0
k4h7vwe,"&gt; It’s terrible what is happening but please do not use this tragic event (on both sides) to push agendas or as an excuse for hate speech

It’s truly sick the level of picking sides that is going on, I don’t see this in terms of sides, I see this as innocent human beings are suffering. Sadly in times like this the innocent suffer the most.

Religion is truly the biggest monster.",NoahGetTheBoat,2023-10-11 21:50:47,175ofdt,[deleted],,0.0
k4h7pfr,"https://www.instagram.com/reel/CyRaNJmolGf/?igshid=NjIwNzIyMDk2Mg==

This is what isreal doing at gaza and they still doing it.",IsrealPalestineWar_23,2023-10-11 21:49:39,175cw72,Afraid_Candidate_878,2021-12-04 14:22:56,26.0
k4h7h8b,"Basically, the British Empire.",IsrealPalestineWar_23,2023-10-11 21:48:14,175n0fz,LeatherCash4918,2020-08-01 23:06:47,164.0
k4h6x1w,"I think you misread my comment. I wasn’t seriously supposing that the plane fell apart in midair by itself, and that the other plane crashed into the debris. I was saying that, because the caption is obviously WRONG (the picture quite obviously DOESN’T show the B-17 seconds BEFORE colliding; It clearly shows it seconds AFTER. Or the moment OF impact), their wrong caption relays the events incorrectly, thus suggesting that it broke up on its own. They weren’t trying to assert that, but their careless mistake made it it seem so. Clearly, whoever wrote the caption accidentally wrote “seconds BEFORE”, when they actually meant “seconds AFTER”.",TerrifyingAsFuck,2023-10-11 21:44:40,174hw6w,ArmchairCriticSF,2017-05-17 16:15:22,23633.0
k4h63mv,"What you’re describing is comparatively a de-escalation.   I’m asking if the political will is there for the Jews to finally do what they’ve wanted to for the past many centuries.  

Not that you proposal is without merit.",IsrealPalestineWar_23,2023-10-11 21:39:32,175hui1,fuckyourfeelings69,2021-02-12 04:36:48,49.0
k4h5kxr,"I will answer your profoundly stupid question:

Even if true (unlikley), the argument YOU MADE ME/TRICKED ME INTO COMMITTING ATROCITIES has never been a valid defense of anything",IsrealPalestineWar_23,2023-10-11 21:36:17,175frk9,lsa_peasant_farmer,2023-07-23 06:01:29,12549.0
k4h55y7,"Trust me bro, I saw it on telegram. No wait I saw it on RT!",IsrealPalestineWar_23,2023-10-11 21:33:40,175frk9,lsa_peasant_farmer,2023-07-23 06:01:29,12549.0
k4h3w8a,"I think you may have misread the caption. It says it was “*seen* before colliding” but no where in the article does it say anything about falling apart before the collision.

https://preview.redd.it/onkplsnv4ntb1.jpeg?width=828&amp;format=pjpg&amp;auto=webp&amp;s=c73e93b4db3b8f51da432fbb00a83dd8b254371d

The article specifies that it split in half on impact.",TerrifyingAsFuck,2023-10-11 21:25:45,174hw6w,higzbozo,2018-09-16 00:26:41,4773.0
k4h3v1z,"From the way I understand that this war goes back for many years into the Jesus days. In the Bible it states that Abraham had two sons Isaac and Ishmael and Ishmael he had had with the maid her name was Hagar the father of the Arab Nation and Isaac was the father of all the Jewish Nation home Abraham had with his wife Sarah , she could not conceive and then he wanted children ironically she became pregnant. So because Sarah Abraham's wife could not conceive the maid Hagar from egypt. Depending on who you ask the Jewish people or the Muslim people they were told different things to be totally unbiased. The Bible States that Isaac was to inherit the kingdom of Abraham because he was born to Sarah and Ishmael was told he will be the ruler of a great Nation the Bible says that the Jewish people are the chosen people and they shall in her inherit Jerusalem and then of course something similar was mentioned to the Arab descendants feel that they are entitled to the land of Israel that is the sacred land of the world in the center of the world. But basically it goes all the way back to Abraham and his two sons. The descendants of Abraham who are Ishmael and Isaac have been fighting since the beginning of time.",IsrealPalestineWar_23,2023-10-11 21:25:33,175n0fz,pioneergirl1965,2022-09-17 02:37:30,17021.0
k4h3q3f,If Israel citizens were arms the outcome would of been different.case closed,IsrealPalestineWar_23,2023-10-11 21:24:44,175f8mh,dougeefresh2,2022-09-12 12:57:53,414.0
k4h3lwj,Earth pussy,TerrifyingAsFuck,2023-10-11 21:24:00,174pwu2,monkeybeater26,2021-05-13 07:36:47,16072.0
k4h2dsp,Where is your proof of this…?,IsrealPalestineWar_23,2023-10-11 21:16:29,175frk9,Timely-Mall-9004,2022-02-10 15:06:46,-5.0
k4h0ew7,"Every hand extended was swatted away. Now a fist. Also sick of seeing PA talking to cameras in tailored suits, talking about starving people.",IsrealPalestineWar_23,2023-10-11 21:04:31,175fr8e,GuitarSingle4416,2023-03-03 23:07:02,29997.0
k4gxw1g,"Day late, dollar short…

And it’s the mods you got to convince. Some subs, like r/publicfreakout seem to encourage it.",NoahGetTheBoat,2023-10-11 20:49:26,175ofdt,Interesting-Month-56,,2084.0
k4gxi9d,Hezbollah about to FAFO,IsrealPalestineWar_23,2023-10-11 20:47:09,175fx0l,JHandCock609,2022-12-17 17:24:30,203.0
k4gwd4u,The amount of people not getting the reference 😁,IsrealPalestineWar_23,2023-10-11 20:40:19,175cw72,Jossup,2017-06-01 19:03:29,392.0
k4gvsja,I think it may be simpler if they just take Gaza all together. Move everyone to the West Bank. The killing stops.,IsrealPalestineWar_23,2023-10-11 20:36:54,175hui1,Sir_John_Barleycorn,2022-03-05 20:57:33,9592.0
k4gva4e,Circle of death,IsrealPalestineWar_23,2023-10-11 20:33:48,174wf1h,Ornery-Hovercraft-82,2021-03-29 05:39:54,52.0
k4gtygt,Exactly let God sort em out . Turn that shit into a pile of rocks and dead shit,IsrealPalestineWar_23,2023-10-11 20:25:53,174ce3g,Shadow-Deshaw-2020,2023-10-03 04:00:12,5.0
k4gtnuf,Keep going drop some more until it's just a pile of rocks and dead shit . IDF is going to wipe em off the face of the earth and nobody is gonna do a fucken Thing about it,IsrealPalestineWar_23,2023-10-11 20:24:08,174ce3g,Shadow-Deshaw-2020,2023-10-03 04:00:12,5.0
k4gtgkm,"I think it is because Hamas sent a lot of people over the border to Israel and they murdered a bunch of people. Well Israel didn't think this was a good thing, so they declared war on Hamas for going into Israel and murdering hundreds of Israeli citizens. Hope that helps.",IsrealPalestineWar_23,2023-10-11 20:22:56,175n0fz,Green-Vehicle8424,2020-10-07 05:25:58,4459.0
k4gt9ct,"You aren't going to find many unbiased views, it's just that deeply tied, so you have to look at both and come up with the middle ground.  I'll try myself from readings I've gotten.  I make no claim as to the perfection of this small novel.

By the end of the 19th century (1800s) the UK had a problem it didn't like: Jews were immigrating to the UK fairly heavily with 200k-250k at the turn of the century.

By the 1920s jews had also been actively working to go back to isreal and began independently resettling their homeland.  As such, and because the UK had a growing jewish population, the League of Nations (predeccesor to the UN) gave the UK a mandate: resettle the jews in the holyland from across Europe.

""According to article 22 of the Covenant of the League, the basis for the establishment of the system of international mandates, the authority to define the terms of mandates and the supervision of their execution was entrusted to the Council of the League. On July 24, 1922, the council confirmed the Mandate for Palestine, which included the Balfour Declaration, and the British government was thereby committed to place the country under such political, administrative, and economic conditions as will secure the establishment of the Jewish National Home. ""

The issueL The uk was very antisemitic, and they placed as the administrator of this mandate an arab who was also fervently antisemitic, who along with working to ""resettle jews"" he ALSO called for something else: an immigration of arabs.

Prior to 1922, there wasnt a very large arab population in palestine, it was mostly uninhabited with bedouin nomads/traders and...jews..in jerusalem.  That changed after 1922.  There was no such thing as a ""palestinian"" because it actually wasnt even a word.  The word comes from the roman  “Syria Palaestina” which simply referred to the southern region of syria.  IT was literally never used again until after world war 1 as the designation by the league for the territory.

After 1922 hwoever, arabs began pouring into the region from all over, and besides settling the land, they held pogrom after pogrom of jews (a pogrom is a mass killing of jews)  There is a book called The Pogroms in Palestine” (1929).  The perspective of it I couldn't tell you.

1937 I think is when the UK abandoned the project because it wasn't working.  The jews they were sending were being killed by the arabs that they also called to kill them (it wasnt national policy, again its what happens when you put a non-neutral party in charge of a project he hates)

The resettlement wouldn't be brought up again until after the world war 2 when instead of a trickle of jews, it was a flood as they globally sought to escape the horrors of europe.  This time the UN as a whole was to administer the process.  What you wound up with is several different channels of dsicussion between what was the arabic version of the UN, the Arab League, the UN, and the leaders of the resettlment movement (whats generally called the xionist movement).  In the end, there was a promise of the establishment of 2 states: A palestinian state which had the majority of palestin, and the isreali state.  The nation known as Jordan was created as a result which holds the majority of ""Palestine'

The day the UN announced it was done and Isreal was it's own nation, literally the day, every nation (including Jordan) attacked isreal with the intent of destroying it.  Thus began the animosity between Isreal and the region as a whole regarding actual nation states.  That isreal not only defeated the league but took massive tracts of territory didn't help.

You then have basicaly 50-60 years of on/off warfare as the remains of the arab league kept trying to kill isreal and it failed.  Finally,. tactics changed and instead of armies, it became insurgencies and the likes of hamas and hezbollah were born.

Open the 21st century:  In 2000, literally every single day there would be a bombing or shootup of a cafe, bus, hospital, market, something, by anti-isreali terrorists operating out of the west bank and gaza.  By this point, Isreal had offered palestinians on (5?) seperate occasions peace deals that included up to 94% of the territory they asked for.  It was soundly rejected every time, with every deal being responded to with increased waves of attacks.Isreal, since no natiuon can be seen as weak and survive, would respond to every terrorist attack with an attack on supposed terrorist locations.  Locations almost always placed intentionally next to civilian targets. The vast majority (but not all) of the killings by isreal of palestinian civilians is because it was intentionally designed to be so by groups like hamas, for whom no sacrifice was too much, especially the sacrifice of people they didn't care for (the locals)

Due to isreals inability to stop the attacks, they finally got desperate and in a last resort before outright anhialation: they built a wall to seperate the palestinians from the isrealis.  Gaza is called an open air prison, and for good reason to the isrealis: the most dangerous people to their society are imprisoned there: hamas along with 2 million supporters who have never appeared to actively seek peace, only elimination of isreal.  Thhe walls though were a double edged sword: It DID succeed in slowing attacks from the west bank and gaza because it's much easier to guard a wall than open fields and streets, but it created an isolated breeding ground of resentment (deserved or not) of/by the locals.

Palestine as a whole has received insane amounts of foreign aid compared to the actual land space getting it.  There are many who argue that despite the wall, gaza could be one of the most richest and beautiful cities in Isreali territory with all the money that has been sent there.  Obviously, a significant portion was diverted to purchasing weapons.

And that brings us to where we are now: 5 generations of conflict back and forth.  The arabs for some reason refuse to permit an isreali state at all despite the isrealis being the only ethnic group to ever have an actual nation in the region that wasn't a semi-global empire like the romans, the palestinians are descendents of 20th century immigrants who went there for land and to fight jews.

Both sides have commited atrocities, and my personal opinion is that the isrealis have been incredibly forgiving in their responses.  That roof knocks and phone calls to vacate targeted buildings happen even TODAY supports this belief, while hamas' continued forcing of civilians back into builings they know are about to be blown up continues the trend of sacrificing lives for optics.

I hope that helps, I tried to be neutral overall and provide a base history of events a lot of people don't know of.  Many peopel think this is a conflict going back hundreds of years, it isn't.  They think there is an ethnic group that isrealis forced out of palestine, there actually isn't, that claim cant be made until the 30s and 40s once the arab population had exploded well after the jews had begun resettling the region.

For the current generation of combatants in the region, frankly there's no peaceful outcome anymore.  Peace has been tried by one side and not the other and I' mafraid the only answer now is one side will have to kill the other, despite the ""UN"" and its ""lofty ideals"".",IsrealPalestineWar_23,2023-10-11 20:21:47,175n0fz,Worldsprayer,,335.0
k4gs1ir,He'll yeah love to see it . Level that shit,IsrealPalestineWar_23,2023-10-11 20:14:38,174o2qt,Shadow-Deshaw-2020,2023-10-03 04:00:12,5.0
k4grlxi,War crimes.,IsrealPalestineWar_23,2023-10-11 20:12:05,174seli,InterestingCourse907,2020-12-30 02:00:53,24207.0
k4grf19,"https://youtu.be/AWKmazrRIwA?si=jXDIBrd0EnLhNYxj

Best one I have found",IsrealPalestineWar_23,2023-10-11 20:10:56,175n0fz,princessfabiola,2013-11-17 15:37:31,2177.0
k4gqv7i,The Ukraine WAR is not an equivalent. The deletion of isis beheading videos would be an equivalent.,IsrealPalestineWar_23,2023-10-11 20:07:37,1753j9l,AndyTheHutt420,,56.0
